,nama,harga,penjual,kota,rating
512,Mixkey Sad Boy Artisan Keycaps - Nautilus,Rp200.000,Rectangle Store,Jakarta Barat,
513,Pudding Backlit PBT Double Shot Keycaps / Keycap Set,Rp150.000,My neighbour keyboard,Tangerang,4.9
514,Ahegao Keycap PBT Cherry MX Anime keycaps warna Mechanical Keyboard,Rp850.000,NVS Accessories,Jakarta Pusat,
515,Genshin Impact Eula Keycaps| PBT Dye Sub | Cherry Profile | 128 Key,Rp789.000,WASD Project,Jakarta Utara,5.0
516,MACAROON KEYCAPS PBT XDA PROFILE,Rp294.400,SmithOrigin,Jakarta Barat,5.0
517,Keycaps PBT DYE SUB Theory - XDA Profile,Rp294.900,E-BOX,Bekasi,
518,Akko World Tour - London ASA Profile 198 Keycaps Set PBT Doubleshot,Rp765.000,igamerworld,Jakarta Pusat,5.0
519,KEYCAPS PBT EMBER / SHIMMER XDA PROFILE KEYBOARD SUBLIM JAPAN ROOT,Rp295.000,Hans Computer,Jakarta Pusat,
520,WATER GREEN KEYCAPS DOUBLE SHOT PBT Set OEM Profile (119 Keys),Rp300.000,kadesh,Jakarta Barat,5.0
521,Keycaps PBT OEM profile Dye-sublimation Sakura Blossom Japanese style,Rp365.000,Kibaw's store,Jakarta Utara,5.0
522,ALCHA KEYCAPS PBT BACKLIT MECHANICAL KEYBOARD WHITE - BLACK,Rp170.000,aksesorieskomputer,Jakarta Pusat,4.5
523,Ember Shimmer Keycaps PBT Dye Sub XDA Profile Retro Dawn Enlightenment,Rp298.000,gezu,Jakarta Pusat,5.0
524,ALCHA KEYCAPS PBT COFFEE DOUBLE SHOT BACKLIT CAPPUCCINO / LATTEE,Rp195.000,BMS Group Tech,Jakarta Pusat,4.7
525,Ducky S9C3-S108-USPTZ3 English / PBT White And Pink keycaps,Rp605.000,FHC Store,Jakarta Pusat,
526,Honey and Milk XDA Keycaps (Japan Root) PBT DYE SUB 137 keys,Rp359.000,second_toko,Tangerang Selatan,5.0
527,Keycaps PBT Dye Sub CHERRY Profile - HAKU The Green Dragon theme,Rp569.000,LegoDiskon,Tangerang Selatan,5.0
528,Akko Black & Pink Hiragana ASA Profile 158 Keycaps Set PBT Doubleshot,Rp685.000,igamerworld,Jakarta Pusat,5.0
529,PBT Shenpo Apple Extended Keyboard - Mechanical Keyboard Keycaps,Rp579.000,tabbedtabby,Kab. Bantul,5.0
530,KEYCAPS HONEY AND MILK THEME Japanese Root OEM Profile - PBT Dye Sub,Rp300.000,kadesh,Jakarta Barat,3.5
531,Keycaps Super Nintendo 108 PBT Dyesub for Mechanical Gaming Keyboard,Rp379.000,igamerworld,Jakarta Pusat,4.8
532,TITAN NATION Ninja PBT Dyesub Keycaps 129 Set Cherry Profile,Rp535.000,Narvi Gaming,Jakarta Barat,
533,CSA Black Gold Keycaps Double Shot PBT 149 Keysh,Rp399.000,Pribadi uy,Jakarta Selatan,
534,Keycaps 125 Set Cherry PBT Darling Pink 02 Dye Sub,Rp395.000,Tri-TShop,Kab. Sleman,5.0
535,Akko Macaw PBT Double Shot - ASA Keycaps Set,Rp685.000,Cap-stor,Surabaya,4.0
536,Keycaps PBT DYE Sub XDA Profile ENLIGHTMENT OFF WHITE Gray Retro Theme,Rp349.000,LegoDiskon,Tangerang Selatan,4.9
537,ALCHA KEYCAPS PBT CHALK SINGLE SHOT OEM PROFILE 104 KEYS,Rp227.000,COC Komputer,Jakarta Pusat,
538,Keycaps Evangelion EVA 01 PBT Dyesub for Mechanical - Gaming Keyboard,Rp469.000,Narvi Gaming,Jakarta Barat,4.0
539,ALCHA KEYCAPS PBT SAKURA SINGLE SHOT OEM PROFILE WHITE PINK 104 KEY,Rp364.000,COC Komputer,Jakarta Pusat,
540,HyperX Double Shot PBT Keycaps,Rp242.000,Multifungsi,Jakarta Pusat,4.5
541,Side Letter Backlit PBT Doubleshot Keycaps / Keycap Set,Rp275.000,My neighbour keyboard,Tangerang,5.0
542,Keycaps Ukiyo Coral Sea wave Space 6.25u PBT Dye Sub 4 set,Rp115.000,Sinar_Pratama Store,Tangerang Selatan,5.0
543,Keycaps PBT Yin Yang or Tai Chi BOW cherry profile dye-sub,Rp399.000,Kibaw's store,Jakarta Utara,
544,Keycaps Carbon PBT Dye Sub Switch 108 Mechanical Keyboard,Rp219.000,All-In Gaming Shop,Jakarta Utara,5.0
545,Keycaps 132 Set XDA PBT Weather English / Japanese,Rp365.000,Tri-TShop,Kab. Sleman,5.0
546,KEYCAPS KON MOMO PBT CHERRY PROFILE 148KEYS,Rp465.405,Galatix,Bandung,5.0
547,Keycaps Ducky PBT Dye Sublimated White Fullsize,Rp605.000,FHC Store,Jakarta Pusat,
548,ALCHA KEYCAPS GRADIENT GREY PBT DOUBLE SHOT SIDE LETTERS,Rp490.000,BMS Group Tech,Jakarta Pusat,5.0
549,GMK BUSHIDO CLONE KEYCAPS PBT CHERRY PROFILE JAPAN ROOT,Rp390.000,SmithOrigin,Jakarta Barat,5.0
550,Ducky Keycaps S9C3-S104-USP PBT Keycaps Set,Rp604.000,Sylar Gaming Solution,Jakarta Pusat,5.0
551,Yiqi Weather Japanese PBT Dye-sub Keycaps 132 set XDA Profile,Rp299.000,Chemicy Gaming,Jakarta Pusat,5.0
552,Keycaps Pink Sakura PBT Dye Sub Switch 104 Mechanical Keyboard,Rp275.000,All-In Gaming Shop,Jakarta Utara,
553,PBT Keycaps 147 Keys Simple Neon Light Theme XDA Profile Non Backlit,Rp470.000,TheButtonz,Jakarta Barat,
554,Keycap Keycaps Genshin Impact Keqing 129 set OEM profile PBT,Rp557.000,Sinar_Pratama Store,Tangerang Selatan,5.0
555,Red Line V1 PBT Dye Sub Keycaps / Keycap Set,Rp325.000,My neighbour keyboard,Tangerang,5.0
556,Anemo Slime Genshin Impact Artisan Keycap / Keycaps,Rp120.000,PolyPedia,Kab. Tangerang,
557,PULSAR LOW PROFILE KR ANSI Keycaps - Black,Rp349.000,Gamer's Outpost,Jakarta Pusat,5.0
558,Initial D Racing PBT Dye Sub Keycaps / Keycap Set,Rp335.000,My neighbour keyboard,Tangerang,5.0
559,Klee Dodoco Genshin Impact Artisan Keycap / Keycaps,Rp135.000,PolyPedia,Kab. Tangerang,5.0
560,KEYCAP - KEYCAPS - CHERRY - WHITE ON BLACK - PBT - DYE SUB - 126,Rp450.000,Rumah-Keyboard,Jakarta Barat,
561,Transparant Backlit ABS Keycaps / Keycap Set,Rp185.000,My neighbour keyboard,Tangerang,5.0
562,KEYCAP - KEYCAPS - CHERRY - GMK ASHES - PBT - DYE SUB,Rp450.000,Rumah-Keyboard,Jakarta Barat,5.0
563,Letter Color ABS Double Shot Keycaps / Keycap Set,Rp155.000,My neighbour keyboard,Tangerang,4.8
564,KEYCAP - KEYCAPS - CHERRY - MERCURY - GREY WHITE - PBT - DYE SUB,Rp600.000,Rumah-Keyboard,Jakarta Barat,
565,Keycaps PBT DYE Sub CHERRY Profile - WHITE on BLACK JAPAN ROOT,Rp489.000,LegoDiskon,Tangerang Selatan,5.0
566,Akko Psittacus JP PBT Double-shot Keycaps 158 Set ASA Profile,Rp685.000,Sylar Gaming Solution,Jakarta Pusat,5.0
567,Keycaps PBT Matcha dye Sub KT1 Profile,Rp560.000,PKL Mechanical_KB,Jakarta Utara,5.0
568,keycaps pbt,Rp300.000,shabana_snack,Jakarta Selatan,
569,PBT Keycaps 125 Keys Cherry Profile Iceberg Darling Cherry Profile,Rp340.000,TheButtonz,Jakarta Barat,
570,KEYCAPS SOY MILK THEME PBT Cherry Profile - Dye Sub,Rp275.000,kadesh,Jakarta Barat,
571,GAMEN Titan III Mechanical Gaming Keyboard RGB Blue Switch PBT Keycaps,Rp325.000,MAVIC SUKSES ABADI,Jakarta Barat,5.0
572,Titan Nation Ninja PBT Dyesub Keycaps 129 Set Cherry Profile,Rp534.000,DGeva Gaming,Jakarta Pusat,5.0
573,Corsair Keycaps PBT DoubleShot Pro For Mechanical Keyboard,Rp399.000,DGeva Gaming,Jakarta Pusat,5.0
574,Keycaps XDA PBT Massdrop X Mito Clone Canvas Not GMK,Rp499.000,Tri-TShop,Kab. Sleman,5.0
575,PBTFans Keycaps Tray,Rp270.000,Rectangle Store,Jakarta Barat,
576,KEYCAP - KEYCAPS - XDA - KON MOMO - PBT - DYE SUB - WHITE - 126,Rp375.000,Rumah-Keyboard,Jakarta Barat,5.0
577,Keycaps Clone GMK Sumi Cherry Profile Reverse Dye Sub 139 Keys Yongqiu,Rp389.000,Cross Tech Shop,Jakarta Utara,5.0
578,KEYCAP - KEYCAPS - CHERRY - BLACK ON WHITE - PBT - DYE SUB -,Rp490.000,Rumah-Keyboard,Jakarta Barat,5.0
579,Genshin Impact Keycaps Anime Girl Keycaps Mechanical Keyboard Keycap,Rp725.000,NVS Accessories,Jakarta Pusat,5.0
580,Akko BlackPink JP/Japanese PBT Double Shot - ASA Keycaps Set,Rp685.000,Cap-stor,Surabaya,5.0
581,Akko Akafuji PBT Dye-Sub - JDA Keycaps Set,Rp729.000,Cap-stor,Surabaya,5.0
582,PBT Dye Sub Doraemon Keycaps/Key Caps 87 Keys OEM Profile,Rp399.000,HomeMasterID,Jakarta Utara,
583,KEYCAPS PBT SHOKO DOUBLE SHOT OEM PROFILE MECHANICAL KEYBOARD,Rp350.000,BMS Group Tech,Jakarta Pusat,5.0
584,KEYCAP - KEYCAPS - GMK OLIVIA - CHERRY - DOUBLE SHOT PBT - DYE SUB,Rp420.000,Rumah-Keyboard,Jakarta Barat,5.0
585,Paradox Gaming GK1 Black White Red PBT 64/68 Keycaps Mechanical,Rp224.000,Sylar Gaming Solution,Jakarta Pusat,5.0
586,SUPER MARIO KEYCAPS PBT XDA PROFILE,Rp427.500,SmithOrigin,Jakarta Barat,4.8
587,ALCHA KEYCAPS PBT DOUBLE SHOT SUNSET BLUE BACKLIT OEM PROFILE,Rp263.000,COC Komputer,Jakarta Pusat,
588,Keycaps PBT DYE SUB Iceberg Gletser Mountain- XDA Profile,Rp289.900,E-BOX,Bekasi,5.0
589,READY STOCK keycaps gmk dots white pbt dye sub 130keys,Rp480.000,Prings Shop,Jakarta Utara,5.0
590,Keycaps GMK Galaxy Cherry Profile Reverse Dye Sub 139 Keys Yongqiu,Rp389.000,Cross Tech Shop,Jakarta Utara,
591,Matae Keysune Artisan Keycaps,Rp850.000,Rectangle Store,Jakarta Barat,
592,Keycaps Japanese Blue Mountain XDA Profile 126 set with Box,Rp290.000,McyGadgets,Tangerang,
593,Cysm Caps Keyby Artisan Keycaps - Pink,Rp1.200.000,Rectangle Store,Jakarta Barat,
594,Artisan Keycaps Classic Retro Mac / PC Keycap,Rp145.000,My neighbour keyboard,Tangerang,5.0
595,keycaps PBT Super Mario cherry profile Red edition,Rp599.000,Kibaw's store,Jakarta Utara,5.0
596,Press Play FLUX XDA PBT Keycaps Set,Rp439.000,Goodgamingshop,Jakarta Pusat,
597,Press Play RUST JSA Doubleshot PBT Keycaps Keycap Set,Rp349.000,Goodgamingshop,Jakarta Pusat,
598,Shiba Inu Japanese PBT Dye Sublimation Keycaps XDA Profile,Rp539.000,WASD Project,Jakarta Utara,5.0
599,Keycap Keycaps Keyboard NARUTO OEM profile 108pcs PBT dye sublimasi,Rp555.000,Sinar_Pratama Store,Tangerang Selatan,
600,MARIO Keycaps Set | PBT Dye Sub | Cherry Profile | 122 Keys,Rp349.000,WASD Project,Jakarta Utara,5.0
601,NEO HALLYU JSA Doubleshot PBT Keycaps Keycap Set,Rp290.000,Goodgamingshop,Jakarta Pusat,
602,Akko Psittacus JP Hiragana ASA Profile 158 Keycaps Set PBT Doubleshot,Rp685.000,igamerworld,Jakarta Pusat,
603,GMK First Love Clone Keycaps 129 Key Cherry Profile PBT Dye-SUBB,Rp485.000,KeyLube,Jakarta Barat,5.0
604,Keycaps set ANSI Layout PBT for 60% Mechanical Keyboard,Rp275.000,faqihAR,Jakarta Timur,4.9
605,Keycaps Pudding PBT Doubleshot Backlit 108 Keys,Rp200.000,VortexSeries,Jakarta Barat,4.9
606,Akko Black & Pink – The Dancer PBT Double Shot - Cherry Keycaps Set,Rp599.000,Cap-stor,Surabaya,5.0
607,CRP Desko Black R3 by Hammerworks PBT | Cherry Profile Keycaps,Rp2.100.000,Ceeb Station,Depok,
608,Keycaps Pudding 108 PBT for Mechanical Keyboard,Rp225.000,igamerworld,Jakarta Pusat,4.9
609,ALCHA KEYCAPS PBT EARL RED SINGLE SHOT OEM PROFILE 104 KEYS,Rp227.000,COC Komputer,Jakarta Pusat,
610,Side Keycaps Anime Dye Sub PBT,Rp150.000,GoinAjaShop,Kab. Bekasi,5.0
611,ALCHA KEYCAPS PRO SERIES PBT DOUBLE SHOT OEM PROFILE YELLOW - DARKBLUE,Rp250.000,BMS Group Tech,Jakarta Pusat,5.0
612,Keycaps Gundam 108 PBT Dyesub for Mechanical - Gaming Keyboard,Rp379.000,Narvi Gaming,Jakarta Barat,5.0
613,Keycaps Set XDA PBT This Is Plastic Theme,Rp285.000,Tri-TShop,Kab. Sleman,5.0
614,Akko Chicago Theme ASA Profile 158 Keycaps Set PBT Doubleshot,Rp675.000,igamerworld,Jakarta Pusat,5.0
615,Red Line V1 PBT Dye Sub Keycaps / Keycap Set,Rp325.000,My neighbour keyboard,Tangerang,5.0
616,Ducky Bon Voyage PBT Double-Shot - Keycaps,Rp690.000,Goodgamingshop,Jakarta Pusat,
617,Ready NEW Keycaps this is plastic xda profile pbt hypebeast off white,Rp535.000,Prings Shop,Jakarta Utara,5.0
618,Stargaze Keycaps PBT Dye Sub Cherry Profile,Rp499.000,MR Mech,Kab. Tangerang,
619,GMK truffle peach keycaps cherry profile pbt dye sub 138 keycap,Rp537.000,Akemi chan shop,Jakarta Barat,
620,Paradox Ghost Keycaps GSA PBT Grey White Red for Mechanical Keyboard,Rp265.000,Gaming Distro,Jakarta Pusat,5.0
621,Keycaps PBT Mario Retro Xda profile dye sub,Rp499.000,Kibaw's store,Jakarta Utara,4.9
622,Tecware Double Shot Moulded PBT Backlit Keycaps,Rp249.000,Chemicy Gaming,Jakarta Pusat,4.9
623,HyperX Double Shot PBT Keycaps - 104 Mechanical Keycap Set,Rp420.000,Goodgamingshop,Jakarta Pusat,5.0
624,KEYCAPS PBT XDA PROFILE DYE SUB PLANET MECHANICAL KEYBOARD,Rp330.000,Odin Store,Jakarta Pusat,5.0
625,BoW Black on White PBT Double shot Keycaps Clone,Rp590.000,PKL Mechanical_KB,Jakarta Utara,5.0
626,PBT DA DYE-SUB KEYCAPS,Rp719.100,Nmtindo Store,Jakarta Barat,5.0
627,HyperX Double Shot PBT Pudding Keycaps Full Key Set - Black,Rp242.000,Multifungsi,Jakarta Pusat,5.0
628,KEYCAPS GUNDAM GUNPLA PBT SINGLE SHOT OEM PROFILE JAPAN ROOT,Rp350.000,BMS Group Tech,Jakarta Pusat,5.0
629,Bleach PBT Dyesub 134 Set Keycaps Cherry Profile,Rp379.000,Chemicy Gaming,Jakarta Pusat,5.0
630,Keycaps PBT KBDFans modifier MAC Edition,Rp130.000,Kibaw's store,Jakarta Utara,5.0
631,GMK BINGSU CLONE KEYCAPS PBT CHERRY PROFILE JAPAN ROOT,Rp390.000,SmithOrigin,Jakarta Barat,4.5
632,GMK Olivia Keycaps PBT Doubleshoot 173 Keys Clone,Rp599.000,Nekomech,Malang,5.0
633,KEYCAPS PBT XDA PROFILE DYE SUB RETRO VIDEO GAME MARIO V2,Rp350.000,Odin Store,Jakarta Pusat,5.0
634,SA Red Black Pink Accent Profile 170+ Keycaps PBT,Rp700.000,yourpals,Depok,
635,Mixkey Sad Boy Artisan Keycaps - Nautilus,Rp200.000,Rectangle Store,Jakarta Barat,
636,Anemo Slime Genshin Impact Artisan Keycap / Keycaps,Rp120.000,PolyPedia,Kab. Tangerang,
637,PULSAR LOW PROFILE KR ANSI Keycaps - Black,Rp349.000,Gamer's Outpost,Jakarta Pusat,5.0
638,Klee Dodoco Genshin Impact Artisan Keycap / Keycaps,Rp135.000,PolyPedia,Kab. Tangerang,5.0
639,Ori Ajazz AK510 Retro RGB Mechanical Keyboard 104 Key PBT Ball,Rp1.452.000,Toko Unik Import,Jakarta Timur,5.0
640,Keebnoobs Dobu Moonwhite Artisan Keycap,Rp300.000,Rectangle Store,Jakarta Barat,
641,Keychron K2 ver 2 Hot-Swappable RGB Backlight Aluminum Dark Keycap,Rp1.650.000,Keychron Indonesia,Jakarta Barat,5.0
642,Linworks Keycap Tray,Rp200.000,Rectangle Store,Jakarta Barat,
643,Keycap White On Black WOB MSA Profile ABS Double Shot 150 Keys Yongqiu,Rp389.000,Cross Tech Shop,Jakarta Utara,
644,Artisan Keycaps Classic Retro Mac / PC Keycap,Rp145.000,My neighbour keyboard,Tangerang,5.0
645,Keycaps Super Mario Bros PBT Dyesub for Mechanical Gaming Keyboard,Rp379.000,igamerworld bekasi,Bekasi,5.0
646,Genshin Impact Keqing Keycaps| PBT Dye Sub | Cherry Profile | 120 Keys,Rp549.000,WASD Project,Jakarta Utara,5.0
647,Press Play Ebisu PBT Double Shot Keycaps 171 set Cherry Profile,Rp325.000,Narvi Gaming,Jakarta Barat,5.0
648,AHEGAO COLOUR ANIME Keycaps PBT CHERRY PROFILE,Rp304.000,SmithOrigin,Jakarta Barat,5.0
649,KEYCAPS PUDDING PBT Backlit OEM Profile 110 Keys ( tembus LED ),Rp115.000,kadesh,Jakarta Barat,5.0
650,Keycaps PBT Paradox Ghost GSA Dark Grey Red for Mechanical Keyboard,Rp250.000,Gaming Distro Official,Jakarta Pusat,5.0
651,Noir Twilight Keycaps - PBT Doubleshot Cherry Profile Keycap Set,Rp499.000,Noir Gear,Jakarta Barat,5.0
652,Paradox Gaming Keycaps GHOST PBT Dye Sub Side Print Keycaps,Rp270.000,Goodgamingshop,Jakarta Pusat,4.8
653,Titan Nation Fuji Mountain Keycaps PBT Dyesub for Mechanical Keyboard,Rp529.000,igamerworld,Jakarta Pusat,5.0
654,Navy Theme PBT Dye Sub Keycaps / Keycap Set,Rp485.000,My neighbour keyboard,Tangerang,5.0
655,Anemo Slime Genshin Impact Artisan Keycap / Keycaps,Rp120.000,PolyPedia,Kab. Tangerang,
656,Keychron K2 ver 2 Hot-Swappable WHITE Backlight PLASTIC Dark Keycap,Rp1.350.000,Keychron Indonesia,Jakarta Barat,5.0
657,Initial D Racing PBT Dye Sub Keycaps / Keycap Set,Rp335.000,My neighbour keyboard,Tangerang,5.0
658,Klee Dodoco Genshin Impact Artisan Keycap / Keycaps,Rp135.000,PolyPedia,Kab. Tangerang,5.0
659,Ori Ajazz AK510 Retro RGB Mechanical Keyboard 104 Key PBT Ball,Rp1.452.000,Toko Unik Import,Jakarta Timur,5.0
660,ALCHA KEYCAPS PRO SERIES PBT DOUBLE SHOT OEM PROFILE YELLOW - DARKBLUE,Rp465.000,COC Komputer,Jakarta Pusat,
661,Geekark BOW R2 PBT Dye Sub Keycaps Set,Rp199.000,Cap-stor,Surabaya,5.0
662,Akko Carbon Retro CHERRY Profile 229 Keycaps Set PBT Doubleshot,Rp685.000,igamerworld,Jakarta Pusat,5.0
663,PBT KEYCAPS GK64 XD64 DZ60,Rp432.000,PtNmtindo,Jakarta Barat,
664,ASUS ROG PBT Keycap Set 124 Keycaps Doubleshot Molded,Rp449.000,DnG IT Online,Jakarta Selatan,5.0
665,HyperX Double Shot PBT Pudding Keycaps Full Key Set - Black,Rp245.000,Multifungsi Online,Jakarta Pusat,4.8
666,Press Play Scarlet PBT Double Shot Keycaps 171 set Cherry Profile,Rp395.000,Narvi Gaming,Jakarta Barat,
667,Keycaps PBT Hana dye Sub KT1 Profile,Rp560.000,PKL Mechanical_KB,Jakarta Utara,5.0
668,Paradox Keyboard GHOST GH64-PBT Sea&Sun Story Keycaps+Theme Space Bar,Rp815.000,FHC Store,Jakarta Pusat,
669,PBT Dye Sub Evangelion Eva Unit 01 120 Keycaps/Key Caps OEM Profile,Rp650.000,HomeMasterID,Jakarta Utara,
670,Xiao Mask Artisan Keycap / Keycaps,Rp100.000,PolyPedia,Kab. Tangerang,5.0
671,"Custom Built Keychron Q6 100% Full Size Knob Version - Silver Grey - Red Switch, PBT OSA Black",Rp3.650.000,Keychron Indonesia,Jakarta Barat,
672,Dwarf Factory Pokemon Artisan Keycaps,Rp1.200.000,Rectangle Store,Jakarta Barat,
673,Keycaps Clone GMK Sumi Cherry Profile Reverse Dye Sub 139 Keys Yongqiu,Rp389.000,Cross Tech Shop,Jakarta Utara,5.0
674,PBTFans Keycaps Tray,Rp270.000,Rectangle Store,Jakarta Barat,
675,AKKO Black & Silver ASA Profile 197 PBT Double Shot - Keycaps Gaming,Rp598.000,Narvi Gaming,Jakarta Barat,
676,Keycaps PBT DYE Sub CHERRY Profile - WHITE on BLACK JAPANESE ROOT,Rp280.000,The 21's Gallery,Tangerang Selatan,
677,Olive PBT Double shot Keycaps Clone,Rp850.000,PKL Mechanical_KB,Jakarta Utara,4.5
678,NAUTILUS GRAPHITE BLUE THEME KEYCAPS PBT Set OEM Profile (126 Keys),Rp375.000,kadesh,Jakarta Barat,4.9
679,ALCHA KEYCAPS PBT SINGLE SHOT VALENTINE PINK SIDE LETTERS OEM PROFILE,Rp293.000,COC Komputer,Jakarta Pusat,
680,Keycaps Pirate PBT Dye Sub Switch 104 Mechanical Keyboard,Rp310.000,All-In Gaming Shop,Jakarta Utara,5.0
681,Paradox Keyboard GHOST GH64-PBT Sea&Sun Story Keycaps+Theme Space Bar,Rp815.000,Hans Computer,Jakarta Pusat,
682,PBT Dye Sub Seasonic/Sea Whale Blue 110 Keycaps/Key Caps OEM Profile,Rp350.000,HomeMasterID,Jakarta Utara,
683,ALCHA KEYCAPS PBT MODIFIER RGBY SIDE LETTERS / TOP LATTERS LASER PRINT,Rp100.000,BMS Group Tech,Jakarta Pusat,5.0
684,Razer PBT Keycaps 120-Key + Coiled Cable Set for Mechanical Keyboard,Rp799.000,Chemicy Gaming,Jakarta Pusat,5.0
685,ALCHA KEYCAPS PRO SERIES PBT DOUBLE SHOT OEM PROFILE PURPLE - YELLOW,Rp465.000,COC Komputer,Jakarta Pusat,
686,Iris PBT Doble Shot Keycaps Clone,Rp535.000,PKL Mechanical_KB,Jakarta Utara,5.0
687,Genshin Impact Ganyu Keycaps | PBT Dye Sub | Cherry Profile | 120 Keys,Rp499.000,WASD Project,Jakarta Utara,5.0
688,KEYCAPS PBT XDA PROFILE DYE SUB SUSHI BENTO JAPAN MECHANICAL KEYBOARD,Rp320.000,Odin Store,Jakarta Pusat,
689,KEYCAPS GMK CLONE RED SAMURAI PBT DOUBLE SHOT OEM PROFILE KEYBOARD,Rp390.000,Odin Store,Jakarta Pusat,
690,Pudding Keycaps Set | PBT Pudding | OEM Profile | 108 Keys,Rp195.000,WASD Project,Jakarta Utara,5.0
691,Keycaps Pudding 108 PBT for Mechanical Gaming Keyboard,Rp225.000,Sylar Gaming Solution,Jakarta Pusat,5.0
692,ALCHA KEYCAPS PBT SIDE LETTERS PRINT MECHANICAL KEYBOARD WHITE,Rp328.000,COC Komputer,Jakarta Pusat,
693,KEYCAPS PBT PLUM LAVENDER DOUBLE SHOT OEM PROFILE MECHANICAL KEYBOARD,Rp350.000,Hans Computer,Jakarta Pusat,
694,ALCHA KEYCAPS PBT CARBON SINGLE SHOT OEM PROFILE 104 KEYS,Rp227.000,COC Komputer,Jakarta Pusat,
695,Keycaps PBT Dye Sub XDA Retro Colorways,Rp290.000,ThockySupply,Madiun,5.0
696,ALCHA KEYCAPS PBT SINGLE SHOT RAINBOW SIDE LETTERS / PRINT OEM PROFILE,Rp293.000,COC Komputer,Jakarta Pusat,
697,Keycaps PBT Panda XDA profile dye-sub,Rp499.000,Kibaw's store,Jakarta Utara,5.0
698,Yiqi Keycaps Panda PBT Dye-Sub XDA Profile,Rp299.000,Goodgamingshop,Jakarta Pusat,
699,Keycaps Akko Bred ASA Profile 158 Keys PBT Double shot,Rp699.900,Gaming Distro,Jakarta Pusat,5.0
700,Yiqi Keycaps Macaron PBT Dye-Sub XDA Profile,Rp299.000,Goodgamingshop,Jakarta Pusat,
701,KEYCAPS RED SAMURAI THEME PBT OEM Profile ( Double Shot ),Rp375.000,kadesh,Jakarta Barat,
702,Steelseries Prismcaps Universal Double-Shot PBT Keycaps,Rp459.000,Chemicy Gaming,Jakarta Pusat,5.0
703,Galaxy Keycaps PBT OEM Mechanical Keyboard Keycap Galaxy Stars Keycap,Rp425.000,NVS Accessories,Jakarta Pusat,
704,Keycaps PBT Super Mario Theme 109 Cherry Profile Dye Sub,Rp385.000,CanGamingShop,Jakarta Barat,5.0
705,Pulsar Low Profile KR ANSI Keycaps - PBT Doubleshot Gaming Keyboard,Rp349.000,DUNIA COMPUTER & SERVICE,Jakarta Selatan,5.0
706,Keycap Keycaps Keyboard Genshin Impact Cherry profile PBT theme v3,Rp450.000,Sinar_Pratama Store,Tangerang Selatan,5.0
707,Tecware PBT Keycaps Double-Shot PBT - Hitam Grey,Rp249.000,Raja Harddisk,Jakarta Pusat,5.0
708,SAKURA Theme Keycaps PBT CHERRY PROFILE,Rp285.000,SmithOrigin,Jakarta Barat,
709,Keycaps Set Full Black PBT Backlit - 104 Keys - OEM Profile,Rp149.000,Someow-thing,Kab. Bekasi,5.0
710,Keycaps Cherry PBT GMK Darling Zero Two,Rp535.000,Tri-TShop,Kab. Sleman,5.0
711,AHEGAO ANIME Keycaps PBT CHERRY PROFILE,Rp304.000,SmithOrigin,Jakarta Barat,5.0
712,PBT singleshot keycaps dualshot,Rp299.000,Curated By Kwok,Jakarta Utara,5.0
713,Yiqi Keycaps But 86 PBT Dye-Sub Cherry Profile,Rp299.000,Goodgamingshop,Jakarta Pusat,
714,HyperX Double Shot PBT Pudding Keycaps Full Key Set - White,Rp245.000,Multifungsi Online,Jakarta Pusat,4.5
715,Keycaps GMK Galaxy Cherry Profile Reverse Dye Sub 139 Keys Yongqiu,Rp389.000,Cross Tech Shop,Jakarta Utara,
716,Matae Keysune Artisan Keycaps,Rp850.000,Rectangle Store,Jakarta Barat,
717,Keycaps Japanese Blue Mountain XDA Profile 126 set with Box,Rp290.000,McyGadgets,Tangerang,
718,Cysm Caps Keyby Artisan Keycaps - Pink,Rp1.200.000,Rectangle Store,Jakarta Barat,
719,PULSAR LOW PROFILE KR ANSI Keycaps - Black,Rp349.000,Gamer's Outpost,Jakarta Pusat,5.0
720,KEYCAP - KEYCAPS - OEM - PUDDING BLACK - PBT - RGB - SEE THROUGH,Rp140.000,Rumah-Keyboard,Jakarta Barat,5.0
721,Keycaps Keychron K3 - Coral,Rp324.000,Nmtindo Store,Jakarta Barat,4.9
722,KEYCAP - KEYCAPS - OEM - PUDDING WHITE - PBT - RGB - SEE THROUGH,Rp140.000,Rumah-Keyboard,Jakarta Barat,
723,Girl Anime Keycaps OEM Ahegao Keycap untuk Mechanical Keyboard,Rp999.000,NVS Accessories,Jakarta Pusat,
724,KEYCAP - KEYCAPS - XDA - HONEY MILK - PBT - DYE SUB - WHITE - 126,Rp335.000,Rumah-Keyboard,Jakarta Barat,5.0
725,Keycaps 133 Set XDA PBT Ice Mint Crystal Green,Rp370.000,Tri-TShop,Kab. Sleman,5.0
726,NP PBT GREY AND WHITE KEYCAPS SET,Rp799.000,PtNmtindo,Jakarta Barat,
727,ALCHA KEYCAPS PBT COFFEE CAPPUCCINO DOUBLE SHOT BACKLIT OEM PROFILE,Rp273.000,COC Komputer,Jakarta Pusat,
728,KEYCAPS PBT DYE SUB - SAMURAI 117 Keycaps Mechanical Keyboard,Rp499.000,LegoDiskon,Tangerang Selatan,4.8
729,ALCHA KEYCAPS PBT COFFEE CAPPUCCINO SIDE LETTERS OEM PROFILE,Rp293.000,COC Komputer,Jakarta Pusat,
730,Ducky Dual Color Pudding PBT Double Shot Keycaps,Rp415.000,Goodgamingshop,Jakarta Pusat,5.0
731,PBTFans Basin - PBT Doubleshot Cherry Profile Keycaps - KBDFans,Rp2.049.000,LegoDiskon,Tangerang Selatan,
732,Razer Double Shot PBT Keycaps Upgrade Set For Mechanical Keyboard,Rp499.000,Chemicy Gaming,Jakarta Pusat,5.0
733,AKKO World Tour London ASA Profile 198 Keycaps PBT Doubleshot,Rp764.000,Narvi Gaming,Jakarta Barat,5.0
734,Red Samurai Keycaps - Cherry Profile PBT Dye Sub,Rp529.000,LegoDiskon,Tangerang Selatan,5.0
735,Redragon A130 Scarab PBT Pudding Keycaps For Mechanical Keyboard,Rp143.000,GamingIDofficial,Jakarta Utara,5.0
736,KEYCAP - KEYCAPS - XDA - PINK MACAROON - PBT - DYE SUB - WHITE - 126,Rp325.000,Rumah-Keyboard,Jakarta Barat,5.0
737,Super Mario Keycap PBT Cherry MX Keycaps untuk mechanical keyboard,Rp425.000,NVS Accessories,Jakarta Pusat,
738,KEYCAP - KEYCAPS - OEM - PUDDING PINK - PBT - RGB - SEE THROUGH,Rp140.000,Rumah-Keyboard,Jakarta Barat,
739,Komputer Thin Client Cloudsoar Mungil Bertenaga,Rp950.000,E-M-W,Jakarta Pusat,
740,KEYCAPS PBT DYE SUB CHERRY PROFILE - MEMPHIS Theme White Colourfull,Rp499.000,LegoDiskon,Tangerang Selatan,5.0
741,Akko Blue on White PBT Double Shot 197 Keycaps set ASA Profile,Rp599.000,Chemicy Gaming,Jakarta Pusat,5.0
742,Keycaps One Piece PBT 129 Tuts Dyesub for Mechanical - Gaming Keyboard,Rp469.000,Narvi Gaming,Jakarta Barat,
743,GMK Terror Below Clone Keycaps 129 Keys Cherry Profile PBT Dye Sub,Rp386.400,SmithOrigin,Jakarta Barat,5.0
744,Pulsar Low Profile US ANSI - PBT Doubleshot - Keycaps (104 Set US),Rp349.000,Goodgamingshop,Jakarta Pusat,5.0
745,KEYCAPS ARCTIC / ARTIC PBT DOUBLE SHOT OEM PROFILE MECHANICAL KEYBOARD,Rp350.000,BMS Group Tech,Jakarta Pusat,5.0
746,GMK BLISS BALL CLONE KEYCAPS PBT CHERRY PROFILE JAPAN ROOT,Rp390.000,SmithOrigin,Jakarta Barat,5.0
747,Keycaps PBT Lucu unyu 108 Cherry Profile Dye Sub,Rp385.000,CanGamingShop,Jakarta Barat,5.0
748,KEYCAPS PBT PINK BLUE Translucent OEM Profile 106 Keys ( Tembus LED ),Rp125.000,kadesh,Jakarta Barat,5.0
749,ALCHA KEYCAPS PBT RAINDROP SINGLE SHOT OEM PROFILE 104 KEYS,Rp227.000,COC Komputer,Jakarta Pusat,
750,KEYCAP - KEYCAPS - XDA - BANANA FRUIT - PBT - DYE SUB - YELLOW - 120,Rp390.000,Rumah-Keyboard,Jakarta Barat,5.0
751,KEYCAP - KEYCAPS - OEM - PUDDING ORANGE - PBT - RGB - SEE THROUGH,Rp140.000,Rumah-Keyboard,Jakarta Barat,
752,KEYCAP - KEYCAPS - OEM - PUDDING RED - PBT - RGB - SEE THROUGH,Rp140.000,Rumah-Keyboard,Jakarta Barat,5.0
753,KEYCAP - KEYCAPS - XDA - SEA SALT - PBT - DYE SUB - WHITE BLUE,Rp365.000,Rumah-Keyboard,Jakarta Barat,
754,KEYCAP - KEYCAPS - OEM - PUDDING YELLOW - PBT - RGB - SEE THROUGH,Rp140.000,Rumah-Keyboard,Jakarta Barat,
755,Akko Bred ASA Profile 158 Set PBT DBS Mechanical Keycaps,Rp675.000,igamerworld bekasi,Bekasi,5.0
756,KEYCAPS PBT NAUTILUS DOUBLE SHOT OEM PROFILE MECHANICAL KEYBOARD,Rp340.000,BMS Group Tech,Jakarta Pusat,5.0
757,PBT Dye Sub Pacman Keycaps 108 Keys OEM Profile,Rp499.000,HomeMasterID,Jakarta Utara,
758,Akko Black & Bronze ASA Profile 158 Keycaps Set PBT Doubleshot,Rp685.000,igamerworld,Jakarta Pusat,5.0
759,Keycaps 129 Set Cherry PBT Genshin Impact Xiao,Rp570.000,Tri-TShop,Kab. Sleman,5.0
760,ALCHA KEYCAPS PBT EARL ORANGE SINGLE SHOT OEM PROFILE 104 KEYS,Rp227.000,COC Komputer,Jakarta Pusat,
761,AKKO Carbon Retro ASA LOW Profile 154 PBT Double Shot - Keycaps Gaming,Rp498.000,Apparel Gaming,Jakarta Barat,
762,Memphis R1 PBT Dye Sub Keycaps / Keycap Set,Rp275.000,My neighbour keyboard,Tangerang,5.0
763,Noir Luminous Keycaps PBT Doubleshot Cherry Profile Keycap Set,Rp495.000,Tokolaptopid,Jakarta Utara,5.0
764,Keycaps Genshin Impact KEQING PBT Dyesub 146 for Mechanical Keyboard,Rp610.000,igamerworld,Jakarta Pusat,
765,KEYCAPS GUNDAM GUNPLA PBT DYE SUB OEM PROFILE KEYBOARD MECHANICAL,Rp320.000,Odin Store,Jakarta Pusat,
766,Ducky Joker PBT Double-shot - KEYCAPS GAMING,Rp605.000,Narvi Gaming,Jakarta Barat,5.0
767,Redragon PBT Pudding Keycaps for Mechanical Keyboard - SCARAB A130,Rp148.750,Mangga Dua Aksesoris,Jakarta Pusat,
