,nama,harga,penjual,kota,rating
1014,keycaps PBT Psyduck edition with modifier,Rp399.000,Kibaw's store,Jakarta Utara,
1015,Purple on White Keycaps XDA Profile PBT DYE sub,Rp185.000,ZeroPreloved,Jakarta Selatan,
1016,Keycaps Korean Squid Game Theme PBT,Rp420.000,AnShop Banjar,Banjar,5.0
1017,PBT Dream Yu - Mechanical Keyboard Keycaps,Rp499.000,tabbedtabby,Kab. Bantul,5.0
1018,Keycaps PBT This Is Plastic XDA Profile 128 Keys,Rp337.000,Nekomech,Malang,5.0
1019,Crystal Clear Keycaps 155 Keys ASA Profile RGB Friendly (not PBT/ABS),Rp550.000,TheButtonz,Jakarta Barat,
1020,Bleach Theme PBT Dye Sub Keycaps / Keycap Set,Rp225.000,My neighbour keyboard,Tangerang,4.5
1021,ALCHA KEYCAPS PBT DOUBLE SHOT CUSTOM MIX 2 WARNA MECHANICAL KEYBOARD,Rp140.000,BMS Group Tech,Jakarta Pusat,4.9
1022,KEYCAPS SEA SALT THEME Japanese Root - XDA PROFILE PBT,Rp350.000,kadesh,Jakarta Barat,5.0
1023,Olivia White PBT Doubleshot Keycaps / Keycap Set,Rp389.000,My neighbour keyboard,Tangerang,5.0
1024,AKKO Psittacus JP Hiragana ASA Profile 158 Keycaps Set PBT Doubleshot,Rp795.000,Narvi Gaming,Jakarta Barat,5.0
1025,KEYCAP - KEYCAPS - OEM - PUDDING GREY - PBT - RGB - SEE THROUGH,Rp140.000,Rumah-Keyboard,Jakarta Barat,5.0
1026,Side Letter Backlit PBT Doubleshot Keycaps / Keycap Set,Rp275.000,My neighbour keyboard,Tangerang,5.0
1027,KEYCAP - KEYCAPS - CHERRY - GMK BOTANICAL - PBT - DYE SUB,Rp390.000,Rumah-Keyboard,Jakarta Barat,5.0
1028,ALCHA KEYCAPS PBT BACKLIT MECHANICAL KEYBOARD WHITE - RED,Rp247.100,MAGNUN2,Jakarta Barat,
1029,TERLARIS Keycaps PBT + SpaceBar Anime,Rp346.000,BeautyHome_,Kab. Bandung,
1030,HyperX PBT Keycaps - Full Key Set White,Rp471.000,HyperX Flagship Store,Jakarta Utara,5.0
1031,Keycaps Evangelion Ayanami Rei PBT Dyesub 143 for Mechanical Keyboard,Rp469.000,igamerworld bekasi,Bekasi,5.0
1032,VortexSeries Orange Black PBT Double Shot CSA Profile Keycaps,Rp199.000,Goodgamingshop,Jakarta Pusat,
1033,alcha keycaps pbt earl orange single shot 108 keys,Rp160.000,Good Stuff Ajar,Jakarta Barat,
1034,108 set Keycap Keycaps Tema Natal Cristmas Oem Profile PBT,Rp250.000,Sinar_Pratama Store,Tangerang Selatan,5.0
1035,Keycaps Set Full White PBT Backlit - 104 Keys - OEM Profile,Rp149.000,Someow-thing,Kab. Bekasi,5.0
1036,Paradox Ghost Keycaps GK1 PBT Black White Red for Mechanical Keyboard,Rp225.000,Gaming Distro,Jakarta Pusat,5.0
1037,KBDFans PG PBT Flighter Keycaps,Rp1.200.000,Leeyeen store,Tangerang,
1038,Keycaps One Piece PBT Dyesub for Mechanical Keyboard,Rp469.000,Igamerworld Store Sby,Surabaya,5.0
1039,VortexSeries White Green PBT Double Shot CSA Profile Keycaps,Rp199.000,Goodgamingshop,Jakarta Pusat,
1040,ALCHA KEYCAPS PBT BACKLIT MECHANICAL KEYBOARD GREY - RED,Rp240.100,MAGNUN2,Jakarta Barat,
1041,HyperX Double Shot PBT Keycaps Black,Rp420.000,HyperX Flagship Store,Jakarta Utara,5.0
1042,108 Keys OEM PBT Keycaps Full Set Mechanical Keyboard Cute Pikachu Key,Rp425.000,NVS Accessories,Jakarta Pusat,5.0
1043,Redragon A130 Scarab PBT Pudding Keycaps For Mechanical Keyboard,Rp145.000,Tokolaptopid,Jakarta Utara,4.8
1044,Redragon PBT Pudding Keycaps for Mechanical Keyboard - SCARAB A130,Rp140.000,REDRAGON INDONESIA,Jakarta Utara,4.9
1045,Keycaps PBT Dye Sub Cherry Profile - DEMONGIRL theme,Rp569.000,LegoDiskon,Tangerang Selatan,5.0
1046,Razer PBT Keycap + Coiled Cable (upgrade set) - Gaming Keycaps,Rp798.000,Apparel Gaming,Jakarta Barat,5.0
1047,Keycaps Genshin Impact Xiao PBT 140 Keys XDA For Mechanical Keyboard,Rp570.000,igamerworld,Jakarta Pusat,
1048,Keycaps Cherry PBT JTK Clone Night Sakura,Rp565.000,Tri-TShop,Kab. Sleman,5.0
1049,Autumn Japanese Root Keycaps 117 Keys PBT Dye Sub OEM Profile,Rp425.000,Sikibima Store,Kab. Karawang,5.0
1050,KEYCAPS PBT XDA PROFILE DYE SUB NEON LIGHT / CRAYON MILKY,Rp350.000,Odin Store,Jakarta Pusat,
1051,HyperX Alloy Origins PBT Keycaps Fullsize Mechanical Gaming Keyboard,Rp1.890.000,DUNIA COMPUTER & SERVICE,Jakarta Selatan,
1052,ALCHA KEYCAPS PBT DOUBLE SHOT SUNSET BLUE BACKLIT OEM PROFILE,Rp260.000,aksesorieskomputer,Jakarta Pusat,5.0
1053,YIQI Keycaps Apple Wind Design PBT Dye Sub XDA Profile,Rp299.000,GOODGAMINGM2M,Jakarta Pusat,5.0
1054,ALCHA KEYCAPS PBT COFFEE SIDE / TOP LETTERS SINGLE SHOT OEM PROFILE,Rp225.000,BMS Group Tech,Jakarta Pusat,5.0
1055,alcha keycaps pbt earl orange single shot 108 keys,Rp160.000,Good Stuff Ajar,Jakarta Barat,
1056,Akko Black & Rose ASA Profile 197 Set PBT Doubleshot - Keycaps Gaming,Rp739.000,Narvi Gaming,Jakarta Barat,5.0
1057,Keychron K5 Full SIze White Backlight Gateron Mechanical Aluminum Body - Red Switch,Rp1.675.000,Keychron Indonesia,Jakarta Barat,5.0
1058,KEYCAPS VIRTUAL WAR & WARFARE XDA profile PBT dye sub,Rp385.000,kadesh,Jakarta Barat,4.8
1059,KEYCAP - KEYCAPS - MA - BLUE CAT - PBT - DYE SUB - BLUE - 125 KEYS,Rp365.000,Rumah-Keyboard,Jakarta Barat,
1060,KBDfans KAT BOW 226 White PBT Dye-sub Keycaps Mechanical Keyboard,Rp1.772.000,Archase,Jakarta Barat,5.0
1061,PBT MINILA GREY AND GREEN KEYCAPS,Rp405.000,Nmtindo Store,Jakarta Barat,4.0
1062,Alcha Keycaps Pudding PBT Mechanical Keyboard Full Size 108 - Black,Rp275.000,Duta mandiri infokom,Jakarta Pusat,5.0
1063,HyperX PBT Keycaps Double Shot PBT Material,Rp279.000,ST-Toms.co,Jakarta Utara,
1064,KEYCAPS PBT DYE SUB XDA PROFILE - Honey and Milk Theme Japanese Root,Rp280.000,NVlogic,Kab. Bekasi,
1065,Keycaps Set Yellow & Black PBT Backlit - 104 Keys - OEM Profile,Rp149.000,Someow-thing,Kab. Bekasi,4.9
1066,TITAN NATION Egypt Pharaoh PBT Dyesub Keycaps 130 Set Cherry Profile,Rp475.000,Narvi Gaming,Jakarta Barat,
1067,ALCHA KEYCAPS PBT EARL RED SINGLE SHOT SIDE LETTERS OEM PROFILE 104,Rp250.000,thelma tech,Jakarta Pusat,5.0
1068,Paradox Keyboard GHOST GH64-GSA PBT Dye-Sublimation/ Keycaps(DG/G/R),Rp815.000,Hans Computer,Jakarta Pusat,
1069,140 Kunci GMK Tema Firaun Keycaps Hitam Kuning PBT Lima Sisi Sublimas,Rp1.693.000,ASJAD STOREE,Jakarta Barat,
1070,Blue Samurai Keycaps PBT Double Shot OEM Profile,Rp399.000,MR Mech,Kab. Tangerang,
1071,Grim Reaper Haloween PBT Keycaps Set,Rp400.000,Ravelt,Jakarta Utara,5.0
1072,ALCHA KEYCAPS PBT RAINDROP SINGLE SHOT SIDE LETTERS OEM PROFILE 104,Rp250.000,aksesorieskomputer,Jakarta Pusat,5.0
1073,KEYCAPS BANANA FRUIT PBT XDA PROFILE JAPAN ROOT MECHANICAL KEYBOARD,Rp295.000,BMS Group Tech,Jakarta Pusat,5.0
1074,Paradox Gaming GSA Grey White Red PBT 64/68 Keycaps Mechanical,Rp265.000,igamerworld bekasi,Bekasi,5.0
1075,PBT Dye Pokemon Pikachu 110 Keycaps/Key Caps OEM Profile,Rp700.000,HomeMasterID,Jakarta Utara,
1076,Taichi BoW Keycaps Japanese PBT Cherry Profile,Rp380.000,AnShop Banjar,Banjar,
1077,EPBT X GOK BOW R2 KEYCAPS SET - PBT Dye Sub Cherry Profile,Rp1.249.000,LegoDiskon,Tangerang Selatan,5.0
1078,ALCHA KEYCAPS PBT CHALK SINGLE SHOT OEM PROFILE 104 KEYS,Rp225.000,thelma tech,Jakarta Pusat,5.0
1079,ALCHA KEYCAPS PBT SINGLE SHOT VALENTINE PINK SIDE LETTERS OEM PROFILE,Rp290.000,aksesorieskomputer,Jakarta Pusat,5.0
1080,Noir Javanese Roots BOW Fullset PBT Dye Sub Keycaps Cherry Profile,Rp379.000,Chemicy Gaming,Jakarta Pusat,
1081,Keycaps Geekark PBT Accent R2,Rp250.000,Reintheart,Jakarta Barat,5.0
1082,Keycaps Coral Sea Japanese PBT - Mechanical Gaming Keyboard Custom,Rp349.000,Clover Gaming Indonesia,Bandung,5.0
1083,Paradox GSA-PBT Dye-sub /Keycaps GSA PBT Dye-sub,Rp265.000,GOODGAMINGM2M,Jakarta Pusat,5.0
1084,Keycaps PBT Virtual war Xda profile dye sub,Rp525.000,Kibaw's store,Jakarta Utara,5.0
1085,Noir Olive Keycaps PBT Double Shoot Cherry Profile,Rp495.000,Tokolaptopid,Jakarta Utara,
1086,GMK Analog Dream Clone Keycaps 191 Keys Cherry Profile PBT Dye Sub,Rp423.000,SmithOrigin,Jakarta Barat,5.0
1087,Rei Ayanami EVANGELION PBT Dye Sub Keycaps Mechanical Keyboard,Rp270.000,Goodgamingshop,Jakarta Pusat,
1088,Keycaps Initial D Japanese PBT Cherry Profile,Rp320.000,AnShop Banjar,Banjar,5.0
1089,HyperX Double Shot PBT Keycaps - White,Rp240.000,PLUTUS tech,Jakarta Pusat,5.0
1090,Gaming City PBT Dye Sub Keycaps / Keycap Set,Rp379.000,My neighbour keyboard,Tangerang,5.0
1091,ALCHA KEYCAPS PBT EARL ORANGE SINGLE SHOT SIDE LETTERS OEM PROFILE 104,Rp250.000,aksesorieskomputer,Jakarta Pusat,5.0
1092,ALCHA KEYCAPS PBT SINGLE SHOT SUNSET BLUE SIDE LETTERS OEM PROFILE,Rp290.000,aksesorieskomputer,Jakarta Pusat,5.0
1093,ALCHA KEYCAPS GRADIENT GREY PBT DOUBLE SHOT MECHANICAL KEYBOARD,Rp490.000,Hans Computer,Jakarta Pusat,
1094,Paradox Keyboard GHOST GH64-GK1 PBT Radium Vulture/ Keycaps(B/W/R),Rp815.000,Hans Computer,Jakarta Pusat,
1095,Redragon PBT Pudding Keycaps for Mechanical Keyboard - SCARAB A130,Rp138.000,PRIME TECH INDONESIA,Jakarta Barat,
1096,HyperX Alloy Origins (Red switch) - PBT keycaps - Gaming Keyboard,Rp1.890.000,HyperX Flagship Store,Jakarta Utara,
1097,Daxa M64 Keycaps XDA Profile PBT Dye sub,Rp200.000,Bareona,Jakarta Barat,
1098,Mario PBT Dye Sub Keycaps B Mechanical Gaming Keyboard 123 Keys,Rp320.000,NVlogic,Kab. Bekasi,5.0
1099,Akko Black & Pink Hiragana ASA Profile Set 158 PBT Doubleshot Keycaps,Rp685.000,igamerworld bekasi,Bekasi,5.0
1100,Classic FC / Famicom PBT Dye Sub Keycaps / Keycap Set,Rp495.000,My neighbour keyboard,Tangerang,5.0
1101,KEYCAPS MACARON THEME XDA Profile - PBT Dye Sub,Rp350.000,kadesh,Jakarta Barat,5.0
1102,HyperX PBT Keycaps - Full Key Set Black,Rp471.000,HyperX Flagship Store,Jakarta Utara,
1103,KEYCAPS MATCHA GREEN THEME Japanese Root - XDA PROFILE PBT,Rp330.000,kadesh,Jakarta Barat,4.9
1104,KEYCAP - KEYCAPS - CHERRY - SAKURA - PBT - DYE SUB - 122 KEYS,Rp300.000,Rumah-Keyboard,Jakarta Barat,
1105,CORSAIR PBT DOUBLE-SHOT PRO Keycap Mod Kit,Rp399.000,Gamer's Outpost,Jakarta Pusat,5.0
1106,KEYCAPS - SIKAKEYB - GREEN WHITE - PBT - OEM HEIGHT - SPHERICAL,Rp399.000,Rumah-Keyboard,Jakarta Barat,5.0
1107,HyperX Alloy Origins (Red switch) - PBT keycaps - Gaming Keyboard,Rp1.890.000,HyperX Flagship Store,Jakarta Utara,
1108,KEYCAP - KEYCAPS - XDA - ICE CREAM - PBT - DYE SUB,Rp290.000,Rumah-Keyboard,Jakarta Barat,
1109,HyperX PBT Keycaps - Full Key Set Pink,Rp471.000,HyperX Flagship Store,Jakarta Utara,
1110,Keycaps White On Black WOB PBT Double Shot 136 Keys,Rp310.000,My Officially Store,Kab. Bantul,
1111,Keycaps Super Nintendo 108 PBT Dyesub for Mechanical Gaming Keyboard,Rp379.000,igamerworld bekasi,Bekasi,5.0
1112,Paradox Gaming Ghost 108 PBT Dye Sub Carbon Keycaps,Rp265.000,igamerworld,Jakarta Pusat,5.0
1113,Hyperx Alloy Origins Core Keyboard Gaming PBT Keycaps,Rp1.590.000,ST-Toms.co,Jakarta Utara,
1114,Tecware PBT Keycaps - WHITE GREY,Rp279.000,toko expert komputer,Jakarta Pusat,
1115,Colour Pen PBT Dye Sub Keycaps / Keycap Set,Rp335.000,My neighbour keyboard,Tangerang,5.0
1116,104 PBT Keycaps Mekanik Keyboard Cherry MX OEM Kunci Merah Kuning To,Rp1.607.000,ASJAD STOREE,Jakarta Barat,
1117,Ducky Keycaps S9C3-S104-USP PBT Keycaps Set,Rp605.000,Goodgamingshop,Jakarta Pusat,
1118,Keycaps Pokemon Pikachu PBT Dyesub for Mechanical - Gaming Keyboard,Rp379.000,Narvi Gaming,Jakarta Barat,5.0
1119,KEYCAPS PBT CHERRY PROFILE DYE SUB SEA TOPIC BLUE,Rp370.000,Odin Store,Jakarta Pusat,
1120,AKKO Black & Cyan ASA Profile 197 Set PBT Doubleshot - Keycaps Gaming,Rp739.000,Narvi Gaming,Jakarta Barat,5.0
1121,VortexSeries Pudding Keycaps PBT Doubleshot Backlit 108 Keys - Hitam,Rp297.020,MAS SQUARE,Jakarta Timur,
1122,HyperX Alloy Origins Core (Red) - PBT keycaps - Gaming Keyboard,Rp1.590.000,HyperX Flagship Store,Jakarta Utara,5.0
1123,Keycaps Mechanical Keyboard Single Shot PBT FullSet 108 Key Cherry Stm,Rp230.000,Trendy Store Solo 01,Surakarta,5.0
1124,KEYCAPS - SIKAKEYB - WHITE GREY - PBT - OEM HEIGHT - SPHERICAL,Rp399.000,Rumah-Keyboard,Jakarta Barat,
1125,HyperX Alloy Origins Keryboard- PBT keycaps,Rp1.890.000,Goodgamingshop,Jakarta Pusat,
1126,Paradox Keyboard GHOST GH64-GK1 PBT Radium Vulture/ Keycaps(B/W/R),Rp815.000,FHC Store,Jakarta Pusat,
1127,ALCHA KEYCAPS PBT SIDE LETTERS PRINT MECHANICAL KEYBOARD WHITE,Rp325.000,aksesorieskomputer,Jakarta Pusat,5.0
1128,Mechanical Keyboard Ducky One TKL White PBT Dye Keycaps Blue Cherry MX,Rp1.225.000,Fitrah Jaya Computer,Jakarta Pusat,5.0
1129,keycaps PBT cherry blossom japanese dye sublimation oem profile,Rp149.000,Kibaw's store,Jakarta Utara,5.0
1130,KEYCAP - KEYCAPS - OEM - PUDDING PINK - PBT - RGB - SEE THROUGH,Rp140.000,Rumah-Keyboard,Jakarta Barat,
1131,KBDfans KAT Alpha PBT Mechanical Keyboard Keycaps Set,Rp1.527.000,Archase,Jakarta Barat,5.0
1132,Keycaps Akko Chicago ASA Profile 158 Keys PBT Double shot,Rp675.000,Gaming Distro,Jakarta Pusat,5.0
1133,Keycaps Gundam 108 PBT Dyesub for Mechanical Gaming Keyboard,Rp379.000,igamerworld bekasi,Bekasi,5.0
1134,Tecware Double Shot Moulded PBT Backlit Keycaps,Rp249.000,Sylar Gaming Solution,Jakarta Pusat,5.0
1135,CORSAIR PBT DOUBLE-SHOT PRO Keycap Mod Kit - Mint Green,Rp399.000,Corsair Official Store,Jakarta Pusat,5.0
1136,Noir Olive Keycaps (168 Key Set),Rp499.000,Noir Gear,Jakarta Barat,4.9
1137,HyperX Pudding Keycaps PBT - Pink,Rp420.000,HyperX Flagship Store,Jakarta Utara,
1138,Nuphy Air 60 - Coast Keycap Twilight Set,Rp500.000,PtNmtindo,Jakarta Barat,
1139,Akko ASA Clear Keycaps - Black,Rp400.000,Rectangle Store,Jakarta Barat,
1140,GMK Bingsu Clone Cherry Profile 130 Keycaps PBT,Rp580.000,yourpals,Depok,5.0
1141,Alcha Keycaps PBT Sakura Single Shot White Pink - Mechanical Keyboard,Rp360.000,Duta mandiri infokom,Jakarta Pusat,
1142,Keycaps Pudding Steelseries PrismCaps Double Shot PBT Black,Rp459.000,Gaming Distro,Jakarta Pusat,5.0
1143,Keycaps Honkai Impact 3 Bronya PBT Dyesub for Mechanical Keyboard,Rp469.000,Narvi Gaming,Jakarta Barat,
1144,PBT Package Cherry Profile Keycaps GMK Parcel Replica,Rp525.000,Gamers Guild,Medan,5.0
1145,KEYCAPS 9009 PBT CHERRY PROFILE SUBLIM MECHANICAL KEYBOARD SINGLE SHOT,Rp330.000,BMS Group Tech,Jakarta Pusat,5.0
1146,Keycaps Genshin Impact 12Pcs|OEM Profile PBT R4,Rp145.000,GoinAjaShop,Kab. Bekasi,5.0
1147,CORGI Keycaps - Cherry Profile PBT Dye Sub KBDFans,Rp589.000,LegoDiskon,Tangerang Selatan,5.0
1148,Hatsune Miku Keycaps PBT,Rp370.000,AnShop Banjar,Banjar,5.0
1149,KEYCAPS HATSUNE MIKU ( Dark Theme ) XDA profile PBT dye sub,Rp350.000,kadesh,Jakarta Barat,5.0
1150,Noir Black and White PBT Double Shot Cherry Profile Keycaps,Rp495.000,Tokolaptopid,Jakarta Utara,
1151,HyperX PBT Double Shot Keycaps Full-key Set Key Caps Gaming Keyboard,Rp279.000,DUNIA COMPUTER & SERVICE,Jakarta Selatan,
1152,PO Cyberpunk 2077 Keycaps 117 PBT Dye Sub OEM Profile no Cherry SA XDA,Rp660.000,Abe Arabe,Jakarta Selatan,5.0
1153,Paradox GHOST PBT Dye Sub Side Print Keycaps Black Orange,Rp265.000,Sylar Gaming Solution,Jakarta Pusat,5.0
1154,Keycaps Alcha PUDDING RGB Mechanical Keyboard Full Size PBT Doble shot,Rp150.000,Odin Store,Jakarta Pusat,5.0
1155,Keycaps Set Cyan & Purple PBT Backlit - 104 Keys - OEM Profile,Rp159.000,Someow-thing,Kab. Bekasi,4.7
1156,KEYCAPS PBT MARSHMALLOW XDA PROFILE SUBLIM COTTON CANDY KEYBOARD,Rp290.000,Hans Computer,Jakarta Pusat,
1157,ALCHA KEYCAPS PBT DOUBLE SHOT SKY BLUE BACKLIT OEM PROFILE,Rp260.000,J&J online,Jakarta Pusat,5.0
1158,Razer PBT Keycaps with Coiled Cable Upgrade Set,Rp779.000,Sylar Gaming Solution,Jakarta Pusat,
1159,ALCHA KEYCAPS PBT CHALK SINGLE SHOT OEM PROFILE 104 KEYS,Rp225.000,aksesorieskomputer,Jakarta Pusat,5.0
1160,PBT Darling Zero Two Keycaps 125 Keys,Rp415.000,Nekomech,Malang,5.0
1161,KEYCAP - KEYCAPS - OEM - PUDDING RED - PBT - RGB - SEE THROUGH,Rp140.000,Rumah-Keyboard,Jakarta Barat,5.0
1162,HyperX Pudding Keycaps PBT Full Key Set for Mechanical Gaming Keyboard,Rp420.000,igamerworld bekasi,Bekasi,
1163,ALCHA KEYCAPS PBT COFFEE LATTE DOUBLE SHOT BACKLIT OEM PROFILE 104 KEY,Rp270.000,aksesorieskomputer,Jakarta Pusat,5.0
1164,ALCHA KEYCAPS PBT CELTIC SINGLE SHOT OEM PROFILE 104 KEYS,Rp225.000,aksesorieskomputer,Jakarta Pusat,5.0
1165,GMK Daifuku Clone Keycaps PBT Dye-Sub Cherry profile 129 Keys,Rp468.600,Caps Sign,Jakarta Barat,
1166,ALCHA KEYCAPS PBT SINGLE SHOT RAINBOW SIDE LETTERS / PRINT OEM PROFILE,Rp290.000,aksesorieskomputer,Jakarta Pusat,5.0
1167,Keycap Keycaps PBT Sub Russian Cyrillic Side Print Cherry Clone,Rp480.000,ThockySupply,Madiun,5.0
1168,KEYCAPS - SIKAKEYB - GREEN WHITE - PBT - OEM HEIGHT - SPHERICAL,Rp399.000,Rumah-Keyboard,Jakarta Barat,5.0
1169,Paradox Gaming Ghost 108 PBT Dye Sub Keycaps,Rp265.000,igamerworld bekasi,Bekasi,
1170,Keycaps PBT DYE SUB XDA Profile - BANANA Fruit theme,Rp389.000,LegoDiskon,Tangerang Selatan,5.0
1171,Keycaps PBT Dye Sub Russian Root Minimalist Retro Cherry not xiami,Rp450.000,ThockySupply,Madiun,5.0
1172,Noir Luminouse PBT Double-shot Keycaps 167 Set Cherry Profile,Rp499.000,DGeva Gaming,Jakarta Pusat,
1173,Astrology keycaps PBT dye sub XDA Profile 138 keycaps,Rp565.000,Akemi chan shop,Jakarta Barat,
1174,XDA Profile Japanese Root 130+ Keycaps PBT,Rp490.000,yourpals,Depok,5.0
1175,Akko Psittacus JP PBT Double-shot Keycaps 158 Set ASA Profile,Rp684.000,DGeva Gaming,Jakarta Pusat,5.0
1176,Keycaps Ducky Joker - PBT Double-shot & Triple Colors Design,Rp605.000,Gaming Distro,Jakarta Pusat,
1177,Ahegao Keycap PBT Cherry MX Anime keycaps warna Mechanical Keyboard,Rp850.000,NVS Accessories,Jakarta Pusat,
1178,Keycap Keycaps Evangelion 116 set PBT profile XDA EVA 06,Rp350.000,Sinar_Pratama Store,Tangerang Selatan,
1179,Corsair Gaming PBT Double-shot Keycaps Full 104 / 105 Keyset - Black,Rp714.000,JOJO Comptech,Jakarta Pusat,5.0
1180,KEYCAPS MINIMALIST WHITE THEME Japanese Root - XDA PROFILE PBT,Rp350.000,kadesh,Jakarta Barat,5.0
1181,KEYCAP - KEYCAPS - XDA - VIRTUAL WAR - PBT - DYE SUB,Rp375.000,Rumah-Keyboard,Jakarta Barat,5.0
1182,HyperX Alloy Origins (Aqua switch) - PBT keycaps - Gaming Keyboard,Rp1.890.000,HyperX Flagship Store,Jakarta Utara,
1183,KEYCAP - KEYCAPS - CHERRY - SUSHI MILK - PBT - DYE SUB - WHITE - 126,Rp365.000,Rumah-Keyboard,Jakarta Barat,
1184,Nuphy Air75 Wireless Mechanical Keyboard + Twilight COAST PBT Keycap,Rp2.499.000,PtNmtindo,Jakarta Barat,5.0
1185,HyperX Alloy Origins Core (Blue) - PBT keycaps - Gaming Keyboard,Rp1.590.000,HyperX Flagship Store,Jakarta Utara,
1186,Razer PBT Keycap Upgrade Set GREEN,Rp499.000,SIBAYAK OFFICIAL STORE,Jakarta Utara,
1187,HyperX PBT Keycaps - Full Key Set White,Rp471.000,HyperX Flagship Store,Jakarta Utara,5.0
1188,KEYCAPS EMBER XDA Profile PBT Sublimation 125 KEYS,Rp350.000,kadesh,Jakarta Barat,4.9
1189,Keyboard Wired Gaming GAMEN Titan III Mechanical RGB Light PBT Keycaps - Gray+Black,Rp322.500,GEN CELL Store,Bekasi,4.8
1190,Akko Black & Gold Hiragana ASA Profile 158 PBT DBS Mechanical Keycaps,Rp685.000,igamerworld bekasi,Bekasi,5.0
1191,Razer Keycaps PBT,Rp420.000,Joan Gaming Komputer,Jakarta Utara,
1192,ALCHA KEYCAPS PBT DOUBLE SHOT SUNSET BLUE BACKLIT OEM PROFILE,Rp260.000,J&J online,Jakarta Pusat,5.0
1193,Keycaps 131 Set Cherry PBT Honkai Impact Bronya Zaychik Silver Wing,Rp850.000,Tri-TShop,Kab. Sleman,5.0
1194,Paradox Gaming Ghost 108 PBT Dye (Sub Carbon) - KEYCAPS GAMING,Rp265.000,Apparel Gaming,Jakarta Barat,5.0
1195,Korean Raindrop cherry profile PBT Double shot (korean root) keycaps,Rp400.000,23K,Jakarta Selatan,
1196,GMK Virtual War CLONE KEYCAPS PBT CHERRY PROFILE,Rp390.000,SmithOrigin,Jakarta Barat,
1197,NP PBT GREY AND WHITE KEYCAPS SET,Rp799.000,Nmtindo Store,Jakarta Barat,5.0
1198,Yiqi Keycaps New cherry PBT Dye-Sub Cherry Profile,Rp330.000,Goodgamingshop,Jakarta Pusat,
1199,GMK SHOKO Keycaps Cherry Profile Dye Sublimasi PBT Mechanical Keyboar,Rp1.651.000,ASJAD STOREE,Jakarta Barat,
1200,HyperX Alloy Origins Core (Aqua) - PBT keycaps - Gaming Keyboard,Rp1.590.000,HyperX Flagship Store,Jakarta Utara,
1201,PULSAR BASIC US ANSI Keycaps - Black,Rp249.000,Gamer's Outpost,Jakarta Pusat,5.0
1202,KEYCAPS HATSUNE MIKU ( Dark Theme ) XDA profile PBT dye sub,Rp350.000,kadesh,Jakarta Barat,5.0
1203,Lavendar Purple PBT Doubleshot Keycaps / Keycap Set,Rp399.000,My neighbour keyboard,Tangerang,4.9
1204,CHESTER keyboard case | GDYNMCS GEAR tas keyboard 60% keychron K6,Rp185.000,Goodynamics store,Kab. Bandung,5.0
1205,PO WoB (White On Black) PBT Doubleshot Cherry Profile Keycaps,Rp630.000,Abe Arabe,Jakarta Selatan,5.0
1206,KEYCAPS SIKAKEYB WHITE GREEN Cherry Profile Spherical PBT Double Shot,Rp400.000,kadesh,Jakarta Barat,5.0
1207,keycaps PBT merry christmas edition,Rp299.000,Kibaw's store,Jakarta Utara,5.0
1208,Yiqi Keycaps Fruit Design PBT Dye Sub XDA Profile,Rp299.000,Goodgamingshop,Jakarta Pusat,
1209,keycaps pbt japanese totoro,Rp240.000,Warung Zufa,Kab. Sleman,
1210,Keycaps keycap XDA Profile PBT Evangelion Eva 02 138 Key Dyesub,Rp565.000,Storm store,Kab. Bekasi,
1211,KEYCAPS PBT DYE SUB CHERRY Profile - BINGSU Theme,Rp649.000,LegoDiskon,Tangerang Selatan,5.0
1212,Ice Cream v2 Keycaps PBT Dye Sub XDA Profile,Rp399.000,MR Mech,Kab. Tangerang,
1213,GMK Trackday Clone Keycaps 136 Keys Cherry Profile PBT Dye Sub,Rp382.200,SmithOrigin,Jakarta Barat,5.0
1214,ALCHA KEYCAPS BLACK ON WHITE BOW PBT DOUBLE SHOT OEM PROFILE KEYBOARD,Rp350.000,Hans Computer,Jakarta Pusat,
1215,KEYCAPS ENLIGHTMENT ROCKET THEME Japanese Root - XDA PROFILE PBT,Rp350.000,kadesh,Jakarta Barat,5.0
1216,HyperX Double Shot PBT Keycaps - White,Rp245.000,Multifungsi Online,Jakarta Pusat,5.0
1217,KEYCAPS ICE MOUNTAIN THEME - XDA PROFILE PBT,Rp335.000,kadesh,Jakarta Barat,4.8
1218,HyperX Double Shot PBT Pudding Keycaps Full Key Set - Black,Rp242.000,Multifungsi,Jakarta Pusat,5.0
1219,KEYCAPS ICE MOUNTAIN THEME JAPANESE ROOT - XDA PROFILE PBT,Rp350.000,kadesh,Jakarta Barat,5.0
1220,Keycaps Razer PBT and Coiled Cable Upgrade Set - Quartz Pink,Rp809.000,Gaming Distro,Jakarta Pusat,
1221,Redragon PBT Pudding Keycaps for Mechanical Keyboard - SCARAB A130,Rp138.000,Multi-Goods Shop,Jakarta Barat,5.0
1222,Tang Dynasty Keycaps Set | PBT Dye Sub | OEM Profile| 110 Keys,Rp399.000,WASD Project,Jakarta Utara,5.0
1223,Tecware Double Shot Moulded PBT Backlit Keycaps,Rp239.000,Freestyle Computer,Jakarta Utara,5.0
1224,Keycaps PBT Paradox Ghost GSA Dark Grey Red for Mechanical Keyboard,Rp250.000,SHERLY MADANI,Jakarta Barat,
1225,SKY CITY TYPE B KEYCAPS PBT CHERRY PROFILE,Rp358.800,SmithOrigin,Jakarta Barat,
1226,Akko Black & Cyan ASA Profile 197 Keycaps Set PBT Doubleshot,Rp740.000,igamerworld,Jakarta Pusat,5.0
1227,ALCHA KEYCAPS PBT EARL RED SINGLE SHOT SIDE LETTERS OEM PROFILE 104,Rp250.000,aksesorieskomputer,Jakarta Pusat,5.0
1228,Tecware PBT Keycaps - BLACK GREY,Rp279.000,toko expert komputer,Jakarta Pusat,
1229,Noir Smoke Keycaps PBT Doubleshot Cherry Profile Keycap Set,Rp495.000,Tokolaptopid,Jakarta Utara,
1230,Keycaps PBT Doubleshot 1 Warna RGB Murah | Tembus LED,Rp129.000,VerrySlytherins Shop,Jakarta Pusat,5.0
1231,Akko Wave ASA Profile 226 Keycaps Set PBT Doubleshot,Rp765.000,igamerworld bekasi,Bekasi,
1232,GMK Alter Keycaps PBT 129 Keys Clone Cherry Profile + Novelties,Rp650.000,Nekomech,Malang,5.0
1233,Keycaps PBT DYE SUB Bubble - XDA Profile,Rp289.900,E-BOX,Bekasi,
1234,Keycaps Keycap Set PBT RK100 100 Keys,Rp299.000,Cherry Electronics,Bogor,
1235,MATCHA Japanese Keycaps Set | PBT Dye Sub | OEM Profile | 108 Keys,Rp399.000,WASD Project,Jakarta Utara,5.0
1236,Keycaps Noir Ocean Cherry Profile PBT Double Shot - 172 Keys Set,Rp499.000,Gaming Distro,Jakarta Pusat,
1237,141 Kunci GMK A Keycaps Profil Ceri PBT Dye Sublimasi Keyboard Mekani,Rp1.886.000,ASJAD STOREE,Jakarta Barat,
1238,KEYCAPS PBT XDA PROFILE DYE SUB GMK CLONE ICE BERG MOUNTAIN JAPAN,Rp320.000,Odin Store,Jakarta Pusat,5.0
1239,Guilty Crown Inori Yuzuriha PBT Dyesub 136 Set Keycaps Cherry Profile,Rp469.000,Chemicy Gaming,Jakarta Pusat,
1240,Honey Bee Yellow PBT Dyesub 145 Set Keycaps Cherry Profile,Rp349.000,Sylar Gaming Solution,Jakarta Pusat,
1241,CARBON Keycaps Set | PBT Laser Carving | OEM Profile | 108 Keys,Rp225.000,WASD Project,Jakarta Utara,5.0
1242,GMK dracula keycaps cherry profile pbt dye sub 137 keycaps,Rp537.000,Akemi chan shop,Jakarta Barat,
1243,Keycaps PBT 124 Keys Matcha Green XDA Profile,Rp313.000,Nekomech,Malang,5.0
1244,Noir Ocean PBT Double-shot Keycaps 172 Set Cherry Profile,Rp499.000,Chemicy Gaming,Jakarta Pusat,
1245,Yiqi Keycaps Video Game Design PBT Dye-Sub XDA Profile,Rp299.000,mog id Bekasi,Bekasi,
1246,AKKO BLACK ROSE PBT Double Shot ASA Profile Keycaps,Rp799.000,LegoDiskon,Tangerang Selatan,
1247,ALCHA KEYCAPS PBT DOUBLE SHOT CUSTOM MIX 2 WARNA MECHANICAL KEYBOARD,Rp170.000,J&J online,Jakarta Pusat,5.0
1248,XDA Bubble Theme PBT keycaps,Rp290.000,AnShop Banjar,Banjar,5.0
1249,Ducky Dual Color Pudding Keycaps PBT for Mechanical Gaming Keyboard,Rp415.000,igamerworld,Jakarta Pusat,
1250,HyperX Alloy Origins Core PBT Keycaps RGB Mechanical Gaming Keyboard,Rp1.589.000,Chemicy Gaming,Jakarta Pusat,5.0
1251,HyperX Alloy Origins Core (Aqua) - PBT keycaps - Gaming Keyboard,Rp1.590.000,HyperX Flagship Store,Jakarta Utara,
1252,DragonBall Keycaps PBT Dragon Ball Dye Sub,Rp330.000,HakoHobby (NGHK),Kab. Sidoarjo,
1253,Novelkeys PBT Cherry Milkshake Keycaps,Rp1.700.000,Gamerzshop,Kab. Tangerang,
1254,Keycaps PBT Double Shot Dark Olivia / Black Pink Cherry Profile,Rp400.000,ThockySupply,Madiun,5.0
1255,Sakura Keycaps PBT OEM Mechanical Keyboard Keycap Japanese Sakura,Rp425.000,NVS Accessories,Jakarta Pusat,
1256,EPbt Cool Kids Clone Keycaps PBT Cherry Profile Dye Sub Mechanical,Rp329.000,Giecaps,Batam,5.0
1257,Evangelion EVA-01 Keycaps GMK Clone PBT 138 Keys,Rp470.000,Sikibima Store,Kab. Karawang,5.0
1258,Akko Black & Rose ASA Profile 197 Set PBT Doubleshot - Keycaps Gaming,Rp739.000,Narvi Gaming,Jakarta Barat,5.0
1259,keycaps xda shimmer pbt - 125 keys,Rp250.000,AeinEohp,Tangerang Selatan,
1260,HyperX Alloy Core RGB Gaming Keyboard,Rp479.900,Multifungsi,Jakarta Pusat,
1261,KEYCAPS HONEY AND MILK THEME Japanese Root XDA Profile - PBT Dye Sub,Rp335.000,kadesh,Jakarta Barat,5.0
1262,Keyboard HyperX Alloy Origins Core ( Red Switch ),Rp949.000,Multifungsi,Jakarta Pusat,5.0
1263,Nuphy Air 60 Wireless Mechanical Keyboard + Nuphy Air 60 NuFolio V2,Rp2.399.000,PtNmtindo,Jakarta Barat,5.0
1264,Keyboard HyperX Alloy Origins Core (Aqua switch),Rp949.000,Multifungsi,Jakarta Pusat,5.0
1265,HyperX Alloy Origins Core (Blue) - PBT keycaps - Gaming Keyboard,Rp1.590.000,HyperX Flagship Store,Jakarta Utara,
