,nama,harga,penjual,kota,rating
768,Pulsar Low Profile US ANSI Keycaps - PBT Doubleshot Gaming Keyboard,Rp349.000,Official Brands,Jakarta Selatan,5.0
769,KEYCAPS PBT WEATHER XDA PROFILE SUBLIM MECHANICAL KEYBOARD,Rp295.000,BMS Group Tech,Jakarta Pusat,5.0
770,Initial D Racing PBT Dye Sub Keycaps / Keycap Set,Rp335.000,My neighbour keyboard,Tangerang,5.0
771,MILKSHAKE KEYCAPS DOUBLE SHOT PBT Set OEM Profile (119 Keys),Rp300.000,kadesh,Jakarta Barat,
772,Keycaps XDA PBT Astrolokeys Astrology Not GMK,Rp465.000,Tri-TShop,Kab. Sleman,
773,ALCHA KEYCAPS PBT COFFEE LATTE DOUBLE SHOT BACKLIT OEM PROFILE 104 KEY,Rp273.000,COC Komputer,Jakarta Pusat,
774,Keycaps PBT Spacebar Evagelion Edition Asuka and Rei Ayanami,Rp120.000,Kibaw's store,Jakarta Utara,5.0
775,Paradox Gaming GK1 Panda edition PBT 64/68 Keycaps Mechanical,Rp255.000,igamerworld,Jakarta Pusat,5.0
776,KEYCAPS PBT XDA PROFILE DYE SUB BANANA FRUIT MECHANICAL KEYBOARD,Rp340.000,Odin Store,Jakarta Pusat,5.0
777,Tecware PBT Two Tones Double-Shot Moulded Backlit LED Keycaps Set,Rp239.000,Clover Gaming Indonesia,Bandung,4.9
778,Keycaps Deer PBT Dye Sub Switch 108 Mechanical Keyboard,Rp210.000,All-In Gaming Shop,Jakarta Utara,5.0
779,Keycaps Sakura Blossom OEM profile PBT (109 + 9 Keys),Rp350.000,FakkuLovers,Jakarta Selatan,
780,PBT Dye Sub Fuji Sakura Japanese Pink 139 Keycaps/Key Caps OEM Profile,Rp449.000,HomeMasterID,Jakarta Utara,
781,Yiqi Keycaps Minimalist white Japanese PBT Dye-Sub Cherry Profile,Rp299.000,Goodgamingshop,Jakarta Pusat,
782,GMK Frost Witch 140 Key PBT Keycaps Cherry Profile Dye Sub Keycaps M,Rp2.240.000,ASJAD STOREE,Jakarta Barat,
783,Keycap Keycaps Evangelion 116 set PBT profile XDA EVA 04,Rp425.000,Sinar_Pratama Store,Tangerang Selatan,
784,Keycaps Razer PBT Double Shot - Mercury White,Rp509.000,Gaming Distro,Jakarta Pusat,5.0
785,Paradox Gaming GSA Grey White Red PBT 64/68 Keycaps Mechanical,Rp265.000,igamerworld,Jakarta Pusat,5.0
786,Keycaps 132 Set XDA PBT Marshmallow,Rp385.000,Tri-TShop,Kab. Sleman,5.0
787,ALCHA KEYCAPS GRADIENT PBT SIDE LETTERS RAINBOW SKY BLUE PINK KEYBOARD,Rp290.000,BMS Group Tech,Jakarta Pusat,5.0
788,PBT Dye Sub Cherry Blossom/Sakura 110 Keycaps/Key Caps OEM Profile,Rp350.000,HomeMasterID,Jakarta Utara,
789,KEYCAPS MACARON THEME XDA Profile - PBT Dye Sub,Rp350.000,kadesh,Jakarta Barat,5.0
790,GMK yuru keycaps pbt dye sub 137 keycaps,Rp537.000,Akemi chan shop,Jakarta Barat,
791,ALCHA KEYCAPS PBT FULL MODIFIER 117 KEYS OEM PROFILE BACKLIT - RANDOM,Rp205.000,Hans Computer,Jakarta Pusat,
792,Evangelion EVA Unit 02 Keycaps XDA Profile PBT DYE SUB Asuka Anime,Rp298.000,gezu,Jakarta Pusat,
793,ALCHA KEYCAPS PBT DOUBLE SHOT BACKLIT MECHANICAL KEYBOARD 104 KEY,Rp130.000,Hans Computer,Jakarta Pusat,
794,Shenpo PBT Dye Sub Keycaps Set,Rp489.000,Cap-stor,Surabaya,5.0
795,KEYCAP - KEYCAPS - OEM - PUDDING LIGHT GREEN - PBT - RGB - SEE THROUGH,Rp140.000,Rumah-Keyboard,Jakarta Barat,5.0
796,KEYCAP - KEYCAPS - CHERRY - GMK PEACH - ORANGE WHITE - PBT - DYE SUB,Rp475.000,Rumah-Keyboard,Jakarta Barat,
797,KEYCAP - KEYCAPS - OEM - PUDDING SKY BLUE - PBT - RGB - SEE THROUGH,Rp140.000,Rumah-Keyboard,Jakarta Barat,
798,Cherry MX Mechanical Gaming Keyboard White G80-3000S TKL NBL,Rp852.500,Cherry Indonesia,Jakarta Utara,5.0
799,Keychron K3 v2 Gateron Low Profile WHITE Wireless Mechanical Keyboard,Rp1.350.000,Keychron Indonesia,Jakarta Barat,5.0
800,KEYCAP - KEYCAPS - OEM - PUDDING SKY BLUE - PBT - RGB - SEE THROUGH,Rp140.000,Rumah-Keyboard,Jakarta Barat,
801,Cherry MX Mechanical Gaming Keyboard Black Full Keys - MX 3.0S NBL,Rp1.100.000,Cherry Indonesia,Jakarta Utara,5.0
802,Keychron K3 v2 Gateron Low Profile WHITE Wireless Mechanical Keyboard,Rp1.350.000,Keychron Indonesia,Jakarta Barat,5.0
803,Cherry MX Mechanical Gaming Keyboard White G80-3000S TKL NBL,Rp852.500,Cherry Indonesia,Jakarta Utara,5.0
804,Keychron K3 Ultra Slim Mechanical Keyboard Low Profile Optical Hotswap,Rp1.449.000,GeekyTech Official,Jakarta Utara,5.0
805,PBT Dye Sub Japanese Pink Flower 108 Keycaps/Key Caps OEM Profile,Rp300.000,HomeMasterID,Jakarta Utara,
806,GMK Hammerhead 173 Keycaps Cherry Profile PBT Double Shot Keycap set,Rp650.000,Vhintz Store,Kab. Bogor,5.0
807,Memphis PBT Dyesub Keycaps,Rp600.000,PKL Mechanical_KB,Jakarta Utara,5.0
808,145 Kunci GMK November Keycaps Kabut Profil Ceri PBT Dye Sublimasi Ke,Rp1.685.000,ASJAD STOREE,Jakarta Barat,
809,KEYCAPS ICE MOUNTAIN THEME JAPANESE ROOT - XDA PROFILE PBT,Rp350.000,kadesh,Jakarta Barat,5.0
810,ALCHA KEYCAPS PBT RAINDROP SINGLE SHOT SIDE LETTERS OEM PROFILE 104,Rp252.000,COC Komputer,Jakarta Pusat,
811,ALCHA KEYCAPS PBT GRANITE SINGLE SHOT SIDE LETTERS OEM PROFILE 104 KEY,Rp252.000,COC Komputer,Jakarta Pusat,
812,Keycaps PBT Rudy cherry profile double-shoot,Rp499.000,Kibaw's store,Jakarta Utara,5.0
813,Noir x After Friday Matcha PBT Dye-sub Keycaps 145 Set Cherry Profile,Rp499.000,Chemicy Gaming,Jakarta Pusat,
814,Keycap Keycaps PBT Die Sub Cherry Assassin Japanese Root,Rp275.000,ThockySupply,Madiun,5.0
815,Keychron K3 ver2 Gateron Low Profile RGB Wireless Mechanical Keyboard,Rp1.500.000,Keychron Indonesia,Jakarta Barat,5.0
816,Cherry MX Mechanical Gaming Keyboard Black G80-3000S TKL NBL,Rp852.500,Cherry Indonesia,Jakarta Utara,5.0
817,Keychron K7 Hot-swappable WHITE Backlight Low Profile Optical Switch - Blue Switch,Rp1.350.000,Keychron Indonesia,Jakarta Barat,5.0
818,Keychron K12 HotSwap RGB Backlight Aluminum Frame Gateron Blue Switch,Rp1.472.500,PtNmtindo,Jakarta Barat,5.0
819,Keychron K6 Hot-Swappable WHITE Backlight PLASTIC Frame Keyboard,Rp1.300.000,Keychron Indonesia,Jakarta Barat,5.0
820,Alcha Keycaps Pudding PBT Mechanical Keyboard Full Size 108 - Pink,Rp275.000,Duta mandiri infokom,Jakarta Pusat,5.0
821,Mechanical Keyboard PBT Pudding Keycaps Redragon SCARAB A130 Keycaps,Rp135.000,REFORMASI COMPUTER,Jakarta Barat,
822,Redragon PBT Pudding Keycaps for Mechanical Keyboard - SCARAB A130,Rp135.000,REFORMASI COMPUTER,Jakarta Barat,
823,KEYCAPS PBT HONEY AND MILK XDA PROFILE MECHANICAL KEYBAORD SUBLIM,Rp295.000,Hans Computer,Jakarta Pusat,
824,ALCHA KEYCAPS PBT SIDE LETTERS PRINT MECHANICAL KEYBOARD WHITE,Rp325.000,Hans Computer,Jakarta Pusat,
825,ALCHA KEYCAPS PBT SINGLE SHOT SIDE LETTERS PRINT CARBON CHALK RAINDROP,Rp200.000,Hans Computer,Jakarta Pusat,
826,ALCHA KEYCAPS PRO SERIES PBT DOUBLE SHOT OEM PROFILE YELLOW - DARKBLUE,Rp460.000,Hans Computer,Jakarta Pusat,
827,ALCHA KEYCAPS GRADIENT PBT SIDE LETTERS RAINBOW SKY BLUE PINK KEYBOARD,Rp290.000,Hans Computer,Jakarta Pusat,
828,SALE..!!! ALCHA KEYCAPS PBT DOUBLE SHOT WARNA MECHANICAL KEYBOARD,Rp110.000,Hans Computer,Jakarta Pusat,
829,ALCHA KEYCAPS PBT MODIFIER RGBY SIDE LETTERS / TOP LATTERS LASER PRINT,Rp100.000,Hans Computer,Jakarta Pusat,
830,Redragon Wireless Mechanical Keyboard Low Profile HORUS TKL- K621-RGB,Rp896.000,REDRAGON INDONESIA,Jakarta Utara,4.7
831,Keychron K7 Hotswap RGB Backlight Low Profile Gateron Mechanical - Blue Switch,Rp1.650.000,Keychron Indonesia,Jakarta Barat,4.9
832,CHERRY MX BOARD 1.0 TKL Mechanical Gaming Keyboard - NBL BLACK,Rp1.045.000,Cherry Indonesia,Jakarta Utara,
833,Keychron K7 Hotswap WHITE Backlight Low Profile Gateron Mechanical - Blue Switch,Rp1.500.000,Keychron Indonesia,Jakarta Barat,5.0
834,Redragon Mechanical Keyboard RGB Ultra Low Profile HORUS TKL- K622-RGB,Rp696.000,REDRAGON INDONESIA,Jakarta Utara,5.0
835,KEYCAPS PBT RUDY MECHANICAL KEYBOARD CHERRY PROFILE DOUBLE SHOT,Rp330.000,Hans Computer,Jakarta Pusat,
836,ALCHA KEYCAPS PBT COFFEE DOUBLE SHOT BACKLIT CAPPUCCINO,Rp195.000,Hans Computer,Jakarta Pusat,
837,SALE ALCHA KEYCAPS PBT FULL MODIFIER CUSTOM MIX 2 WARNA OEM PROFILE,Rp195.000,Hans Computer,Jakarta Pusat,
838,KEYCAPS PBT MATCHA SINGLE SHOT XDA PROFILE SUBLIM MECHANICAL KEYBOARD,Rp295.000,Hans Computer,Jakarta Pusat,
839,ALCHA KEYCAPS PBT FULL MODIFIER CUSTOM MIX 2 WARNA OEM PROFILE BACKLIT,Rp215.000,Hans Computer,Jakarta Pusat,
840,ALCHA KEYCAPS PBT SIDE LETTERS DOUBLE SHOT MECHANICAL KEYBOARD BLACK,Rp325.000,Hans Computer,Jakarta Pusat,
841,ALCHA KEYCAPS PBT COFFEE SIDE / TOP LETTERS SINGLE SHOT OEM PROFILE,Rp225.000,Hans Computer,Jakarta Pusat,
842,KEYCAPS PBT RETRO VIDEO GAME CHERRY PROFILE SUBLIM,Rp335.000,Hans Computer,Jakarta Pusat,
843,ALCHA KEYCAPS PBT SINGLE SHOT CARBON DOLCH RAINDROP CHALK EARL RED,Rp200.000,Hans Computer,Jakarta Pusat,
844,Keycaps PBT Honey Milk 126 Keys XDA Profile,Rp299.000,Nekomech,Malang,5.0
845,ALCHA KEYCAPS PBT DOUBLE SHOT BACKLIT MECHANICAL KEYBOARD 104 KEY,Rp162.000,COC Komputer,Jakarta Pusat,
846,ALCHA KEYCAPS PBT CELTIC SINGLE SHOT OEM PROFILE 104 KEYS,Rp227.000,COC Komputer,Jakarta Pusat,
847,Paradox GHOST PBT Dye Sub Side Print Keycaps Chalk Color,Rp295.000,Sylar Gaming Solution,Jakarta Pusat,5.0
848,KEYCAPS - SIKAKEYB - GREY WHITE - PBT - OEM HEIGHT - SPHERICAL,Rp399.000,Rumah-Keyboard,Jakarta Barat,5.0
849,Keycaps PBT ukiyo-e wave japanese alfabet dye-sublimation oem profile,Rp495.000,Kibaw's store,Jakarta Utara,5.0
850,DSA PBT Top Printed black Keycaps Laser Etched mechanical keyboard,Rp650.000,Archase,Jakarta Barat,5.0
851,ALCHA KEYCAPS PBT SINGLE SHOT SKY BLUE SIDE LETTERS /PRINT OEM PROFILE,Rp293.000,COC Komputer,Jakarta Pusat,
852,ALCHA KEYCAPS PBT EARL ORANGE SINGLE SHOT SIDE LETTERS OEM PROFILE 104,Rp252.000,COC Komputer,Jakarta Pusat,
853,HyperX Alloy Origins PBT Keycaps Fullsize Mechanical Gaming Keyboard,Rp1.890.000,Official Brands,Jakarta Selatan,
854,MILK Japanese Keycaps Set | PBT Dye Sub | Cherry Profile | 140 Keys,Rp549.000,WASD Project,Jakarta Utara,5.0
855,ALCHA KEYCAPS GRADIENT PBT DOUBLE SHOT BACKLIT RAINBOW SKY BLUE PINK,Rp260.000,Hans Computer,Jakarta Pusat,
856,ALCHA KEYCAPS PBT EARL RED SINGLE SHOT SIDE LETTERS OEM PROFILE 104,Rp252.000,COC Komputer,Jakarta Pusat,
857,4pcs Keycaps Japanese Opera Space 6.25u PBT Dye Sub,Rp100.000,Sinar_Pratama Store,Tangerang Selatan,5.0
858,ALCHA KEYCAPS PBT SINGLE SHOT SUNSET BLUE SIDE LETTERS OEM PROFILE,Rp293.000,COC Komputer,Jakarta Pusat,
859,Alcha Keycaps PBT Side Letters Double Shot Mechanical Keyboard - Black,Rp325.000,Duta mandiri infokom,Jakarta Pusat,5.0
860,Press Play HANGEUL GAME Korean Root PBT Dye Sub Keycaps Keycap Set,Rp429.000,Goodgamingshop,Jakarta Pusat,
861,HyperX Alloy Origins Core (Red) - PBT keycaps - Gaming Keyboard,Rp1.590.000,HyperX Flagship Store,Jakarta Utara,5.0
862,VortexSeries Pudding Keycaps PBT Doubleshot Backlit 108 Keys,Rp199.000,Sylar Gaming Solution,Jakarta Pusat,4.8
863,HyperX Alloy Origins Core Keyboard - PBT keycaps,Rp1.590.000,Goodgamingshop,Jakarta Pusat,
864,Keycaps YMDK PBT Blue Beige 61 ANSI,Rp325.000,AigisGamingStore,Jakarta Barat,5.0
865,HyperX Pudding Keycaps PBT - Pink,Rp420.000,HyperX Flagship Store,Jakarta Utara,
866,Paradox Gaming GSA Panda edition PBT 64/68 Keycaps Mechanical,Rp295.000,igamerworld bekasi,Bekasi,5.0
867,ALCHA KEYCAPS PBT DOUBLE SHOT CUSTOM MIX 2 WARNA MECHANICAL KEYBOARD,Rp140.000,Hans Computer,Jakarta Pusat,
868,DROP Artifact Bloom Vintage PBT Keycaps Set,Rp800.000,Abe Arabe,Jakarta Selatan,
869,Pulsar Low Profile US ANSI Keycaps - PBT Doubleshot Gaming Keyboard,Rp349.000,DUNIA COMPUTER & SERVICE,Jakarta Selatan,5.0
870,Keycaps Pudding PBT Doubleshot 108 Keys,Rp225.000,igamerworld bekasi,Bekasi,5.0
871,Avocado Green PBT Dyesub 145 Set Keycaps Cherry Profile,Rp349.000,Sylar Gaming Solution,Jakarta Pusat,
872,ALCHA KEYCAPS PBT GRANITE SINGLE SHOT OEM PROFILE 104 KEYS,Rp227.000,COC Komputer,Jakarta Pusat,
873,QPBT Terminal PBT KEYCAPS cherry profile,Rp939.999,berudustore,Jakarta Selatan,
874,Ukiyo Keycaps 104 Keys Dye Sub PBT Coral Sea Wave and Mousepad 1 set,Rp330.000,RnKey,Jakarta Barat,5.0
875,Keychron K3 ver 2 Gateron Low Profile WHITE Backlight + Travel Pouch - Brown Switch,Rp1.499.000,Keychron Indonesia,Jakarta Barat,5.0
876,Cherry MX Mechanical Gaming Keyboard TKL White Backlight - MX 8.0 PINK,Rp3.025.000,Cherry Indonesia,Jakarta Utara,
877,Keychron M1 Ultra-Light Optical Mouse,Rp599.000,Keychron Indonesia,Jakarta Barat,5.0
878,Keychron K5 Full SIze RGB Backlight Gateron Mechanical Aluminum Body - Red Switch,Rp1.850.000,Keychron Indonesia,Jakarta Barat,5.0
879,Cherry MX Mechanical Gaming Keyboard Black RGB Full Keys - MX 3.0S RGB,Rp1.595.000,Cherry Indonesia,Jakarta Utara,4.8
880,Keychron Q3 QMK TKL FULLY ASSEMBLED Custom Mechanical Keyboard - Grey,Rp3.150.000,Keychron Indonesia,Jakarta Barat,5.0
881,Keychron Q3 QMK TKL FULLY ASSEMBLED Custom Mechanical Keyboard - Blue - Red Switch,Rp3.150.000,Keychron Indonesia,Jakarta Barat,5.0
882,Keychron Q3 QMK TKL FULLY ASSEMBLED Custom Mechanical Keyboard - Black - Red Switch,Rp3.150.000,Keychron Indonesia,Jakarta Barat,4.8
883,Ducky Pudding PBT Doubleshot Backlit Keycaps Set,Rp525.000,FRAG GAMING STORE,Jakarta Pusat,4.5
884,ALCHA KEYCAPS PBT CARBON SINGLE SHOT SIDE LETTERS OEM PROFILE 104 KEYS,Rp252.000,COC Komputer,Jakarta Pusat,
885,KEYCAPS GMK CLONE ARCTIC / ARTIC PBT DOUBLE SHOT OEM PROFILE KEYBOARD,Rp390.000,Odin Store,Jakarta Pusat,
886,PBT Dye Sub White Milk Honey DSA 138 Keycaps,Rp300.000,MGY,Kab. Bogor,
887,ICE CREAM Japanese Keycaps Set | PBT Dye Sub | XDA Profile | 136 Keys,Rp499.000,WASD Project,Jakarta Utara,5.0
888,Keycaps PBT Heart or Love Dye sublimation OEM Profile,Rp180.000,Kibaw's store,Jakarta Utara,5.0
889,Noxelic Keycaps PBT Evangelion Unit-02 - Double Shot 104 Keyset Custom,Rp250.000,Clover Gaming Indonesia,Bandung,4.9
890,ALCHA KEYCAPS PBT DOUBLE SHOT RAINBOW BACKLIT OEM PROFILE,Rp263.000,COC Komputer,Jakarta Pusat,
891,WINMIX PBT SA 9009 KEYCAPS SET Retro 170 keys,Rp1.650.000,Archase,Jakarta Barat,5.0
892,Press Play Shirakawa Japanese Root PBT Keycaps 118 Set OEM Profile,Rp429.000,Sylar Gaming Solution,Jakarta Pusat,
893,Keychron M1 Ultra-Light Optical Mouse,Rp599.000,Keychron Indonesia,Jakarta Barat,5.0
894,HyperX Pudding Keycaps PBT - Black Top,Rp420.000,HyperX Flagship Store,Jakarta Utara,5.0
895,Paradox Gaming GSA DarkGrey Grey Red PBT 64/68 Keycaps Mechanical,Rp254.000,Sylar Gaming Solution,Jakarta Pusat,5.0
896,TECWARE Double Shot Moulded PBT Backlit Keycaps,Rp249.000,Asiatech Solusindo,Jakarta Pusat,5.0
897,GMK Botanical Keycaps 141 Keys PBT (GMK Clone),Rp599.500,Nekomech,Malang,4.9
898,Noir Dusk Keycaps PBT Doubleshot Cherry Profile Keycap Set,Rp495.000,Tokolaptopid,Jakarta Utara,
899,Mechanical Keyboard Ducky One TKL White PBT Keycaps (Brown Cherry MX),Rp1.225.000,Fitrah Jaya Computer,Jakarta Pusat,5.0
900,XDA Evangelion 02 Keycaps PBT 138 Keys,Rp330.000,Nekomech,Malang,4.8
901,KEYCAPS PBT DYE SUB XDA Profile - GREEN MATCHA Theme,Rp349.000,LegoDiskon,Tangerang Selatan,4.9
902,Genshin Impact Xiao PBT Dye Sublimation Keycaps Cherry Profile,Rp789.000,WASD Project,Jakarta Utara,5.0
903,Ukiyo Sea Waves PBT Dye Sub Keycaps 108 Keys,Rp240.000,Delse,Kab. Tangerang,
904,Keycaps Pudding Steelseries PrismCaps Double Shot PBT White,Rp459.000,Gaming Distro,Jakarta Pusat,5.0
905,4pcs Keycaps Japanese Foxy Black Space 6.25u PBT Dye Sub,Rp100.000,Sinar_Pratama Store,Tangerang Selatan,5.0
906,AKKO Bred (158-key) ASA Profile PBT Double Shot - Keycaps Gaming,Rp675.000,Apparel Gaming,Jakarta Barat,5.0
907,Pokemon Keycap 2 PBT OEM Mechanical Keyboard Keycap Pikachu Keycaps,Rp800.000,NVS Accessories,Jakarta Pusat,
908,Keycaps Cherry PBT GMK Clone Comet Stargaze Dye Sub,Rp565.000,Tri-TShop,Kab. Sleman,5.0
909,GMK Shoko Clone PBT Doubleshot Keycaps Cherry Profile,Rp329.000,Giecaps,Batam,5.0
910,KEYCAP - KEYCAPS - XDA - VIRTUAL WAR - PBT - DYE SUB,Rp375.000,Rumah-Keyboard,Jakarta Barat,5.0
911,NOIR Javanese Root Keycaps PBT Dye Sub WOB Cherry Profile Keycap,Rp319.000,gagalmiskinstore,Jakarta Barat,
912,HyperX Double Shot PBT Pudding Keycaps Full Key Set - White,Rp242.000,Multifungsi,Jakarta Pusat,4.7
913,AKKO Macaw ASA Profile 199 PBT Double Shot - KEYCAPS GAMING,Rp799.000,Narvi Gaming,Jakarta Barat,5.0
914,Keycaps XDA Kon Momo 126 Keys For Mechanical Keyboard PBT DYE-SUB,Rp290.000,Raven ID,Kab. Wonosobo,5.0
915,ALCHA KEYCAPS PBT COFFEE LATTE SIDE LETTERS OEM PROFILE SINGLE SHOT,Rp293.000,COC Komputer,Jakarta Pusat,
916,Tecware Double Shot Moulded PBT Pudding Backlit Keycaps,Rp299.000,Chemicy Gaming,Jakarta Pusat,4.9
917,Keycaps XDA Sushi Japanese root PBT,Rp315.000,AnShop Banjar,Banjar,5.0
918,Press Play Ukiyo Sea Waves PBT Keycaps 108,Rp299.000,SetyaMV,Tangerang Selatan,
919,Pokemon Squirtle Keycaps Set | PBT Dye Sub | Cherry Profile | 131 Keys,Rp789.000,WASD Project,Jakarta Utara,5.0
920,GMK British Racing Green Keycaps PBT Clone Ready Stock,Rp250.000,Scrappy Tech,Depok,
921,Keycaps Set Dark Brown & Brown PBT Backlit - 104 Keys - OEM Profile,Rp149.000,Someow-thing,Kab. Bekasi,5.0
922,Keycaps Alcha PBT RGB Gaming Mechanical Backlit Double shot 104 Key,Rp130.000,Odin Store,Jakarta Pusat,5.0
923,GMK CAMPING CLONE KEYCAPS PBT CHERRY PROFILE,Rp342.000,SmithOrigin,Jakarta Barat,5.0
924,ALCHA Mechanical Keycaps Transparent Letters Backlit PBT Double Shot,Rp158.000,Kalong77,Jakarta Pusat,4.0
925,AKKO Los Angeles Keycaps ASA Profile 157 Keys PBT Double Shot,Rp750.000,El Patron Shop,Jakarta Barat,5.0
926,PBT Milk Cover - Mechanical Keyboard Keycaps,Rp499.000,tabbedtabby,Kab. Bantul,5.0
927,Press Play Ebisu PBT Double Shot Keycaps 171 set Cherry Profile,Rp325.000,Apparel Gaming,Jakarta Barat,
928,Keycaps PBT This is Plastic theme XDA Profile Dye-Sub,Rp339.000,Kibaw's store,Jakarta Utara,5.0
929,Keycaps Akko Macaw ASA Profile 199 Keys PBT Double shot,Rp739.000,Gaming Distro,Jakarta Pusat,
930,Pulsar Low Profile KR ANSI PBT Doubleshot Keycaps 104 Set (US/KR),Rp349.000,Chemicy Gaming,Jakarta Pusat,5.0
931,ALCHA KEYCAPS PBT DOLCH SINGLE SHOT SIDE LETTERS OEM PROFILE 104 KEYS,Rp252.000,COC Komputer,Jakarta Pusat,
932,HANGEUL GAME korean root PBT Dye Sub Keycaps set by press play,Rp300.000,Aquazumi,Depok,
933,Keycaps PBT Dye Sub CHERRY Profile - Soy Milk Theme,Rp379.000,LegoDiskon,Tangerang Selatan,5.0
934,Game Color PBT Dye Sub Keycaps / Keycap Set,Rp335.000,My neighbour keyboard,Tangerang,5.0
935,PBT Shenpo Blue on Grey - Mechanical Keyboard Keycaps,Rp539.000,tabbedtabby,Kab. Bantul,5.0
936,Yiqi Keycaps Cheese Cat PBT Dye Sub XDA Profile,Rp299.000,Goodgamingshop,Jakarta Pusat,
937,Akko Black & Rose ASA Profile 197 Keycaps Set PBT Doubleshot,Rp740.000,igamerworld,Jakarta Pusat,5.0
938,PBT Keycaps 125 Keys Ember Brown Soft Pastel Classic Theme XDA Profile,Rp325.000,TheButtonz,Jakarta Barat,
939,One Piece Keycaps Anime Backlit 1.25u PBT 7pcs OEM Profile,Rp125.000,GoinAjaShop,Kab. Bekasi,
940,AKKO Black & Pink Hiragana ASA Profile 158 PBT Double Shot - Keycaps,Rp684.000,Narvi Gaming,Jakarta Barat,5.0
941,Ready keycaps xda weird cat pbt dye sub 131keys cute pink yellow,Rp500.000,Prings Shop,Jakarta Utara,5.0
942,Keycaps 124 Set XDA PBT Matcha Japanese / English Dye Sub,Rp310.000,Tri-TShop,Kab. Sleman,5.0
943,Carbon Keycaps 108 Keys Dye Sub PBT,Rp220.000,RnKey,Jakarta Barat,5.0
944,NP Xda Profile Keycaps 125 keys PBT shimmer theme include tray,Rp250.000,djaps shop,Jakarta Utara,5.0
945,EVA Keycaps Mechanical Keyboard Sublime PBT ASUKA 108,Rp319.000,All For Work,Jakarta Barat,5.0
946,Coral Sea PBT Dye Sub Keycaps / Keycap Set,Rp275.000,My neighbour keyboard,Tangerang,5.0
947,GOMU Keycaps Mechanical Keyboard Full Size Keycaps PBT,Rp249.000,All For Work,Jakarta Barat,5.0
948,Q1 & K2 OEM Dye-Sub PBT Keycap Set,Rp640.000,Keychron Indonesia,Jakarta Barat,4.9
949,PRIM Mechanical Gaming Keycaps EVA No. 6 Machine Theme XDA,Rp355.000,All For Work,Jakarta Barat,5.0
950,Moon Keycaps PBT Dye Sub Cherry Profile,Rp599.000,MR Mech,Kab. Tangerang,
951,KBDfans NP PBT CRAYON KEYCAPS SET mechanical keyboard,Rp1.322.000,Archase,Jakarta Barat,5.0
952,ALCHA KEYCAPS PBT CELTIC SINGLE SHOT SIDE LETTERS OEM PROFILE 104,Rp252.000,COC Komputer,Jakarta Pusat,
953,AKKO Black & Cyan ASA Profile 197 Set PBT Doubleshot - Keycaps Gaming,Rp739.000,Narvi Gaming,Jakarta Barat,5.0
954,GMK Oblivion Keycaps Moonrise Keycaps PBT Dye Sublimasi Mechanical Ke,Rp1.647.000,ASJAD STOREE,Jakarta Barat,
955,KEYCAPS PUDDING / PUDING BACKLIT MECHANICAL KEYBOARD PBT,Rp195.000,glow sistem,Jakarta Utara,5.0
956,KEYCAPS MINIMALIST WHITE THEME Japanese Root V2 - CHERRY PROFILE PBT,Rp300.000,kadesh,Jakarta Barat,5.0
957,ALCHA KEYCAPS PBT GRANITE SINGLE SHOT SIDE LETTERS OEM PROFILE 104 KEY,Rp250.000,thelma tech,Jakarta Pusat,4.8
958,XDA Mountain japanese keycaps PBT,Rp299.000,AnShop Banjar,Banjar,5.0
959,Keycaps PBT Bubble theme XDA Profile Dye-Sub,Rp339.000,Kibaw's store,Jakarta Utara,
960,Keychron K3 Keycap Set,Rp299.000,Keychron Indonesia,Jakarta Barat,4.8
961,Javanese Roots WOB full set keycaps - PBT Dye Sub Cherry Profile,Rp379.000,Noir Gear,Jakarta Barat,4.8
962,Minimalist White Japanese PBT Dye Sub Keycaps / Keycap Set,Rp335.000,My neighbour keyboard,Tangerang,5.0
963,Gamen TITAN III Keyboard Gaming Mechanical Switch Blue RGB PBT Keycaps,Rp320.000,mmcroxy.onlineshop,Jakarta Pusat,5.0
964,Pirate Theme PBT Dye Sub Keycaps / Keycap Set,Rp275.000,My neighbour keyboard,Tangerang,5.0
965,Sushi Japanese PBT Dye Sub Keycaps / Keycap Set,Rp355.000,My neighbour keyboard,Tangerang,5.0
966,Akko Psittacus JP/Japanese PBT Double Shot - ASA Keycaps Set,Rp685.000,Cap-stor,Surabaya,5.0
967,Akko Black & Cyan ASA Profile 197 Keycaps Set PBT Doubleshot,Rp570.000,mog id Bekasi,Bekasi,
968,Keycaps Evangelion EVA 08 Pink PBT Dyesub 120 for Mechanical Keyboard,Rp469.000,Narvi Gaming,Jakarta Barat,
969,GMK Hatsune Miku Clone Keycaps 124 Keys PBT Dye-Sub OEM Profile,Rp319.000,Caps Sign,Jakarta Barat,
970,Keycaps Noir Black and White Cherry Profile PBT 1.5mm - 153 Keys Set,Rp499.000,Gaming Distro,Jakarta Pusat,
971,CORAL SEA KEYCAPS PBT CHERRY PROFILE,Rp304.000,SmithOrigin,Jakarta Barat,5.0
972,Ready Keycaps GMK red samurai 173keys pbt cherry profile double shot,Rp620.000,Prings Shop,Jakarta Utara,5.0
973,KEYCAPS PBT PLUM LAVENDER DOUBLE SHOT OEM PROFILE MECHANICAL KEYBOARD,Rp350.000,BMS Group Tech,Jakarta Pusat,5.0
974,ALCHA KEYCAPS PBT DOUBLE SHOT CUSTOM MIX 2 WARNA MECHANICAL KEYBOARD,Rp172.000,COC Komputer,Jakarta Pusat,
975,Keychron Cherry Profile Double-Shot PBT Keycaps,Rp750.000,Keychron Indonesia,Jakarta Barat,
976,Blue Samurai PBT Doubleshot Keycaps / Keycap Set,Rp389.000,My neighbour keyboard,Tangerang,5.0
977,Keychron OEM Profile PBT Retro Keycap Set,Rp640.000,Keychron Indonesia,Jakarta Barat,5.0
978,KEYCAP - KEYCAPS - CHERRY - SUSHI MILK - PBT - DYE SUB - BLUE - 126,Rp365.000,Rumah-Keyboard,Jakarta Barat,5.0
979,HyperX Pudding Keycaps PBT - White Top,Rp420.000,HyperX Flagship Store,Jakarta Utara,4.9
980,PBT Dye Sub NBA Lakers Keycaps 115 Keys OEM Profile,Rp499.000,HomeMasterID,Jakarta Utara,
981,4pcs Keycaps R1 Opt Pbt Untuk Keyboard Mac 1.25u 1.25x,Rp149.999,wiBai,Jakarta Timur,
982,Keycaps PBT ukiyo-e wave dye-sublimition oem profile 110 keys NEW,Rp450.000,Kibaw's store,Jakarta Utara,5.0
983,Steelseries Prismcaps - Universal Double Shot PBT Keycaps,Rp460.000,OriginaeShop,Jakarta Pusat,5.0
984,Keycaps PBT Double Shot/ Keycaps Murah,Rp100.000,GhaDul,Kab. Bekasi,
985,Keycaps Pudding PBT Doubleshot Backlit 104 Mechanical Premium Quality,Rp139.900,Online Mandiri Store,Jakarta Utara,4.8
986,Keycaps PBT Double Shot Cherry Profile - DENIM Blue Theme,Rp675.000,LegoDiskon,Tangerang Selatan,5.0
987,HyperX Double Shot PBT Keycaps,Rp245.000,Multifungsi Online,Jakarta Pusat,4.0
988,Steelseries PRISMCAPS Universal Double Shot PBT Keycaps,Rp460.000,ST-Toms.co,Jakarta Utara,5.0
989,Noir Javanese Roots BOW Full Set Keycaps PBT Dye Sub Cherry Profile,Rp375.000,Tokolaptopid,Jakarta Utara,
990,Noir x After Friday Matcha PBT Dye-sub Keycaps 145 Set Cherry Profile,Rp499.000,Sylar Gaming Solution,Jakarta Pusat,
991,GMK Ninja Clone Keycaps 136 Keys Cherry Profile PBT Dye Sub,Rp399.000,SmithOrigin,Jakarta Barat,
992,VortexSeries Crimson Black PBT Double Shot CSA Profile Keycaps,Rp199.000,Goodgamingshop,Jakarta Pusat,
993,HyperX PBT Double Shot Keycaps Full-key Set Key Caps Gaming Keyboard,Rp279.000,Official Brands,Jakarta Selatan,
994,Keycaps Set Gray & Black PBT Backlit - 104 Keys - OEM Profil,Rp149.000,Someow-thing,Kab. Bekasi,5.0
995,Paradox Gaming GK1 64 / 68 Set PBT Keycaps Keyboard Cherry Profile,Rp225.000,DGeva Gaming,Jakarta Pusat,5.0
996,Paradox Gaming GH-21 / GH21 PBT Numpad Keycaps / ABS Case / USB Type C,Rp375.000,igamerworld bekasi,Bekasi,4.5
997,KBDFans WOB PBT Double Shot Keycaps Set,Rp625.000,KVC Store,Jakarta Utara,
998,alca double PBT keycaps kombinasi 3 warna custom OEM Profile rexus da,Rp110.000,Vybert Shop,Jakarta Utara,
999,Pastel color keycaps XDA profile pbt dye sub 134 keycaps,Rp637.000,Akemi chan shop,Jakarta Barat,
1000,ALCHA KEYCAPS PBT SINGLE SHOT SKY BLUE SIDE LETTERS /PRINT OEM PROFILE,Rp290.000,aksesorieskomputer,Jakarta Pusat,5.0
1001,ALCHA KEYCAPS PBT DOLCH SINGLE SHOT SIDE LETTERS OEM PROFILE 104 KEYS,Rp250.000,thelma tech,Jakarta Pusat,5.0
1002,Keycaps PBT Dye Subs Yongqiu Dots Clone Cherry Profile (not GMK),Rp390.000,ThockySupply,Madiun,5.0
1003,Yiqi Keycaps Original Design PBT Dye-Sub MDA Profile,Rp329.000,Goodgamingshop,Jakarta Pusat,
1004,VortexSeries Pink Black PBT Double Shot CSA Profile Keycaps,Rp199.000,Goodgamingshop,Jakarta Pusat,
1005,VALENTINE Keycaps - PBT DYE SUB NP Profile - KBDFans,Rp989.000,LegoDiskon,Tangerang Selatan,5.0
1006,Keycaps Evangelion Ayanami Rei PBT Dyesub 143 for Mechanical Keyboard,Rp469.000,Apparel Gaming,Jakarta Barat,5.0
1007,KEYCAPS GMK CLONE OLIVIA / FLAMINGO PBT DOUBLE SHOT OEM PROFILE,Rp390.000,Odin Store,Jakarta Pusat,
1008,KEYCAPS PBT DoubleShot CHERRY Profile - OLIVIA Theme,Rp829.000,LegoDiskon,Tangerang Selatan,5.0
1009,Keycaps PBT Matcha Edition XDA profile dye-sub,Rp299.000,Kibaw's store,Jakarta Utara,5.0
1010,Yiqi Apple Wind Design PBT Dye-sub Keycaps 127 set XDA Profile,Rp299.000,Chemicy Gaming,Jakarta Pusat,
1011,KEYCAPS NAUTILUS GRAPHITE BLUE PBT DOUBLE SHOT OEM PROFILE GMK CLONE,Rp350.000,Odin Store,Jakarta Pusat,
1012,PBT Dye Sub Mario Bowser 110 Keycaps/Key Caps OEM Profile 2021 ver,Rp400.000,HomeMasterID,Jakarta Utara,
1013,7 Keycaps Oem Bahan Pbt Motif Lebah Jepang Untuk Keyboard,Rp199.999,wiBai,Jakarta Timur,
