,nama,harga,penjual,kota,rating
0,EVA Keycaps Mechanical Keyboard Sublime PBT ASUKA 108,Rp319.000,All For Work,Jakarta Barat,5.0
1,Coral Sea PBT Dye Sub Keycaps / Keycap Set,Rp275.000,My neighbour keyboard,Tangerang,5.0
2,GOMU Keycaps Mechanical Keyboard Full Size Keycaps PBT,Rp249.000,All For Work,Jakarta Barat,5.0
3,Q1 & K2 OEM Dye-Sub PBT Keycap Set,Rp640.000,Keychron Indonesia,Jakarta Barat,4.9
4,PRIM Mechanical Gaming Keycaps EVA No. 6 Machine Theme XDA,Rp355.000,All For Work,Jakarta Barat,5.0
5,GAMEN Titan III Mechanical Gaming Keyboard RGB Blue Switch PBT Keycaps,Rp325.000,MAVIC_STORE,Jakarta Barat,4.9
6,ALCHA KEYCAPS PBT DOUBLE SHOT CUSTOM MIX 2 WARNA MECHANICAL KEYBOARD,Rp140.000,BMS Group Tech,Jakarta Pusat,4.9
7,Gundam Unicorn Japanese PBT Dye Sub Keycaps Keycap Set,Rp349.000,Press Play,Jakarta Utara,4.9
8,RES Retro Entertainment System Press Play x Jebbra PBT Keycaps,Rp389.000,Press Play,Jakarta Utara,5.0
9,RUST JSA Doubleshot PBT Keycaps Keycap Set,Rp349.000,Press Play,Jakarta Utara,5.0
10,SALE..!!! ALCHA KEYCAPS PBT DOUBLE SHOT WARNA MECHANICAL KEYBOARD,Rp110.000,BMS Group Tech,Jakarta Pusat,4.9
11,Mario PBT Dye Sub Keycaps Full Size 108 Keys,Rp349.000,Press Play,Jakarta Utara,4.9
12,PBTFANS™ PURPOLCH Keycaps PBT Double Shot Cherry Profile,Rp1.249.000,LegoDiskon,Tangerang Selatan,5.0
13,NEO HALLYU JSA Doubleshot PBT Keycaps Keycap Set,Rp349.000,Press Play,Jakarta Utara,4.9
14,SCARLET PBT Doubleshot Keycaps Keycap Set,Rp399.000,Press Play,Jakarta Utara,5.0
15,Javanese Roots WOB full set keycaps - PBT Dye Sub Cherry Profile,Rp379.000,Noir Gear,Jakarta Barat,4.8
16,Keychron K3 Keycap Set,Rp299.000,Keychron Indonesia,Jakarta Barat,4.8
17,Minimalist White Japanese PBT Dye Sub Keycaps / Keycap Set,Rp335.000,My neighbour keyboard,Tangerang,5.0
18,Gamen TITAN III Keyboard Gaming Mechanical Switch Blue RGB PBT Keycaps,Rp320.000,mmcroxy.onlineshop,Jakarta Pusat,5.0
19,Pirate Theme PBT Dye Sub Keycaps / Keycap Set,Rp275.000,My neighbour keyboard,Tangerang,5.0
20,PBTFans WOB White On Black PBT Double Shot Cherry Profile Keycaps,Rp1.299.000,LegoDiskon,Tangerang Selatan,5.0
21,FITT Plastic Keyboard Keycaps XDA PBT For Mechanical Keyboard - AFW,Rp315.000,All For Work,Jakarta Barat,4.9
22,ALCHA KEYCAPS PBT DOUBLE SHOT BACKLIT MECHANICAL KEYBOARD 104 KEY,Rp130.000,BMS Group Tech,Jakarta Pusat,4.9
23,KEYCAPS PBT HONEY AND MILK XDA PROFILE MECHANICAL KEYBAORD SUBLIM,Rp295.000,BMS Group Tech,Jakarta Pusat,5.0
24,Rei Ayanami EVANGELION PBT Dye Sub 142 Keycaps Mechanical Keyboard,Rp349.000,Press Play,Jakarta Utara,4.8
25,9009 PBT Dye Sub Sublimated Keycaps Set,Rp349.000,Press Play,Jakarta Utara,5.0
26,KEYCAPS PBT EMBER / SHIMMER XDA PROFILE KEYBOARD SUBLIM JAPAN ROOT,Rp295.000,BMS Group Tech,Jakarta Pusat,5.0
27,60% Keycaps Japanese Root Ukiyo Sea Waves Coral PBT OEM Profile,Rp250.000,gezu,Jakarta Pusat,4.9
28,Coral Sea PBT Dye Sub Keycaps / Keycap Set,Rp275.000,My neighbour keyboard,Tangerang,5.0
29,KEYCAPS PBT MATCHA SINGLE SHOT XDA PROFILE SUBLIM MECHANICAL KEYBOARD,Rp295.000,BMS Group Tech,Jakarta Pusat,4.9
30,Keychron Cherry Profile Double-Shot PBT Keycaps,Rp750.000,Keychron Indonesia,Jakarta Barat,
31,KEYCAP - KEYCAPS - CHERRY - SUSHI MILK - PBT - DYE SUB - BLUE - 126,Rp365.000,Rumah-Keyboard,Jakarta Barat,5.0
32,Blue Samurai PBT Doubleshot Keycaps / Keycap Set,Rp389.000,My neighbour keyboard,Tangerang,5.0
33,Keychron OEM Profile PBT Retro Keycap Set,Rp640.000,Keychron Indonesia,Jakarta Barat,5.0
34,HyperX Pudding Keycaps PBT - White Top,Rp420.000,HyperX Flagship Store,Jakarta Utara,4.9
35,FLAMINGO Doubleshot PBT Keycaps Keycap Set,Rp399.000,Press Play,Jakarta Utara,5.0
36,KEYCAPS MINIMALIST WHITE THEME Japanese Root - OEM PROFILE PBT,Rp250.000,kadesh,Jakarta Barat,5.0
37,Minimalist White Japanese PBT Dye Sub Keycaps / Keycap Set,Rp335.000,My neighbour keyboard,Tangerang,5.0
38,FLUX XDA PBT Keycaps Set by Press Play,Rp329.000,Press Play,Jakarta Utara,4.8
39,Ukiyo Sea Waves PBT Dye Sub Keycaps 108 Keys,Rp349.000,Press Play,Jakarta Utara,4.9
40,Mario Bros Theme PBT Dye Sub Keycaps / Keycap Set,Rp295.000,My neighbour keyboard,Tangerang,4.9
41,WoB White on Black PBT Doubleshot Keycaps Set by Press Play,Rp299.000,Press Play,Jakarta Utara,4.9
42,KEYCAPS ICE MOUNTAIN THEME - XDA PROFILE PBT,Rp335.000,kadesh,Jakarta Barat,4.8
43,Pudding Backlit PBT Double Shot Keycaps / Keycap Set,Rp150.000,My neighbour keyboard,Tangerang,4.9
44,MARS GREEN KEYCAPS PBT OEM PROFILE,Rp304.000,SmithOrigin,Jakarta Barat,4.9
45,ALCHA KEYCAPS PBT FULL MODIFIER CUSTOM MIX 2 WARNA OEM PROFILE BACKLIT,Rp215.000,BMS Group Tech,Jakarta Pusat,4.9
46,Tecware Double Shot PBT Backlit Keycaps - Gaming Keycaps,Rp239.000,Goodgamingshop,Jakarta Pusat,4.9
47,GUNDAM KEYCAPS PBT OEM PROFILE Dye Sub 123 Keys ( NEW EDITION ),Rp350.000,kadesh,Jakarta Barat,4.9
48,Carbon Classic PBT Dye Sub Keycaps / Keycap Set,Rp175.000,My neighbour keyboard,Tangerang,4.9
49,ALCHA KEYCAPS PBT SINGLE SHOT CARBON DOLCH RAINDROP CHALK EARL RED,Rp200.000,BMS Group Tech,Jakarta Pusat,4.9
50,Redragon PBT Pudding Keycaps for Mechanical Keyboard - SCARAB A130,Rp140.000,REDRAGON INDONESIA,Jakarta Utara,4.9
51,RAVEN Doubleshot PBT Keycaps Set,Rp369.000,Press Play,Jakarta Utara,4.6
52,TOUCAN XDA PBT Keycaps Set by Press Play,Rp329.000,Press Play,Jakarta Utara,4.7
53,BoW Black on White PBT Doubleshot Keycaps Set by Press Play,Rp299.000,Press Play,Jakarta Utara,4.9
54,HyperX Pudding Keycaps - Double Shot PBT Keycap Set,Rp420.000,Sylar Gaming Solution,Jakarta Pusat,5.0
55,HANGEUL GAME Korean Root PBT Dye Sub Keycaps Keycap Set by Press Play,Rp349.000,Press Play,Jakarta Utara,5.0
56,Keyboard Wired Gaming GAMEN Titan III Mechanical RGB Light PBT Keycaps,Rp322.500,GEN CELL Store,Bekasi,4.8
57,Genshin Impact HU TAO PBT Dye Sub Keycaps Mechanical Keyboard,Rp389.000,Press Play,Jakarta Utara,5.0
58,Keychron Cherry Profile Double-Shot PBT Full Set Keycaps,Rp750.000,PtNmtindo,Jakarta Barat,3.7
59,PBT keycaps 61% Pro SLEC,Rp219.750,SLEC Official Store,Jakarta Utara,4.9
60,CANOPY Doubleshot PBT Keycaps Keycap Set,Rp369.000,Press Play,Jakarta Utara,5.0
61,KEYCAPS ENLIGHTMENT ROCKET THEME Japanese Root - XDA PROFILE PBT,Rp350.000,kadesh,Jakarta Barat,5.0
62,Press Play Shirakawa Japanese Root PBT Keycaps 118 Set OEM Profile,Rp429.000,Chemicy Gaming,Jakarta Pusat,5.0
63,Gamen TITAN III Keyboard Gaming Mechanical Switch Blue RGB PBT Keycaps,Rp320.000,mmcroxy.onlineshop,Jakarta Pusat,5.0
64,Blue Samurai PBT Doubleshot Keycaps / Keycap Set,Rp389.000,My neighbour keyboard,Tangerang,5.0
65,OLIVIA Keycaps Mechanical Keyboard PBT Dye Sub Doubleshot Red-Samurai,Rp329.000,All For Work,Jakarta Barat,5.0
66,KEYCAPS BLUE CAT THEME - MA PROFILE PBT SET for Mechanical Keyboard,Rp325.000,kadesh,Jakarta Barat,4.9
67,KEYCAPS EMBER XDA Profile PBT Sublimation 125 KEYS,Rp350.000,kadesh,Jakarta Barat,4.9
68,KEYCAPS MINIMALIST WHITE THEME Japanese Root - XDA PROFILE PBT,Rp350.000,kadesh,Jakarta Barat,5.0
69,9009 RETRO KEYCAPS PBT CHERRY PROFILE,Rp304.000,SmithOrigin,Jakarta Barat,5.0
70,CHARM BLUE KEYCAPS DOUBLE SHOT PBT Set OEM Profile (119 Keys),Rp300.000,kadesh,Jakarta Barat,5.0
71,KEYCAP - KEYCAPS - XDA - MARSHMALLOW - PBT - DYE SUB - PURPLE BLAST,Rp375.000,Rumah-Keyboard,Jakarta Barat,5.0
72,ALCHA KEYCAPS PBT SINGLE SHOT SIDE LETTERS PRINT CARBON CHALK RAINDROP,Rp200.000,BMS Group Tech,Jakarta Pusat,4.9
73,GOMU Keycaps Mechanical Keyboard Full Size Keycaps PBT,Rp249.000,All For Work,Jakarta Barat,5.0
74,READY STOCK keycaps xda astrolokeys astrology 138keys pbt dye sub,Rp600.000,Prings Shop,Jakarta Utara,5.0
75,Bleach Theme PBT Dye Sub Keycaps / Keycap Set,Rp225.000,My neighbour keyboard,Tangerang,4.5
76,ALCHA KEYCAPS PBT DOUBLE SHOT CUSTOM MIX 2 WARNA MECHANICAL KEYBOARD,Rp140.000,BMS Group Tech,Jakarta Pusat,4.9
77,KEYCAPS SEA SALT THEME Japanese Root - XDA PROFILE PBT,Rp350.000,kadesh,Jakarta Barat,5.0
78,AKKO Psittacus JP Hiragana ASA Profile 158 Keycaps Set PBT Doubleshot,Rp795.000,Narvi Gaming,Jakarta Barat,5.0
79,Olivia White PBT Doubleshot Keycaps / Keycap Set,Rp389.000,My neighbour keyboard,Tangerang,5.0
80,Noir Twilight Keycaps - PBT Doubleshot Cherry Profile Keycap Set,Rp499.000,Noir Gear,Jakarta Barat,5.0
81,KEYCAP - KEYCAPS - XDA - MARSHMALLOW - PBT - DYE SUB - PURPLE BLAST,Rp375.000,Rumah-Keyboard,Jakarta Barat,5.0
82,Shoko Blue Ice PBT Doubleshot Keycaps / Keycap Set,Rp389.000,My neighbour keyboard,Tangerang,4.9
83,KEYCAPS - SIKAKEYB - GREY WHITE - PBT - OEM HEIGHT - SPHERICAL,Rp399.000,Rumah-Keyboard,Jakarta Barat,5.0
84,Steelseries PRISMCAPS Universal Double Shot PBT Keycaps - Putih,Rp460.000,ST-Toms.co,Jakarta Utara,5.0
85,Steelseries Prismcaps - Universal Double Shot PBT Keycaps,Rp460.000,Steelseries Indonesia,Jakarta Pusat,5.0
86,EBISU PBT Doubleshot Keycaps Keycap Set,Rp329.000,Press Play,Jakarta Utara,4.9
87,Noir White on Black Keycaps - PBT Doubleshot Cherry Profile Keycap Set,Rp499.000,Noir Gear,Jakarta Barat,5.0
88,SLEC XDA PBT Keycaps for Mechanical keyboard - 138 keys,Rp389.950,SLEC Official Store,Jakarta Utara,5.0
89,Keycaps PBT DYE SUB Shimmer Ember - XDA Profile,Rp294.900,E-BOX,Bekasi,5.0
90,ALCHA KEYCAPS PBT SIDE LETTERS DOUBLE SHOT MECHANICAL KEYBOARD BLACK,Rp325.000,BMS Group Tech,Jakarta Pusat,4.9
91,Noir Javanese Roots Full Set PBT Dye Sub Cherry Profile BOW - Keycaps,Rp379.000,Goodgamingshop,Jakarta Pusat,5.0
92,KEYCAPS PBT CHERRY PROFILE DYE SUB 9009 RETRO,Rp300.000,Odin Store,Jakarta Pusat,5.0
93,PBT Keycaps 125 Keys Blue Cat Theme XDA Profile,Rp335.000,TheButtonz,Jakarta Barat,5.0
94,KEYCAPS PBT BLUE SAMURAI DOUBLE SHOT OEM PROFILE MECHANICAL KEYBOARD,Rp350.000,BMS Group Tech,Jakarta Pusat,4.9
95,KEYCAP - KEYCAPS - XDA - CHALK MATCHA - PBT - DYE SUB - GREEN - 120,Rp275.000,Rumah-Keyboard,Jakarta Barat,5.0
96,Dark Cyan PBT Doubleshot Keycaps / Keycap Set,Rp355.000,My neighbour keyboard,Tangerang,5.0
97,KEYCAP - KEYCAPS - XDA - ROCKET REVELATION - PBT - DYE SUB - GREY,Rp365.000,Rumah-Keyboard,Jakarta Barat,5.0
98,Carbon Classic PBT Dye Sub Keycaps / Keycap Set,Rp175.000,My neighbour keyboard,Tangerang,4.9
99,KEYCAP - KEYCAPS - OEM - PUDDING PURPLE - PBT - RGB - SEE THROUGH,Rp140.000,Rumah-Keyboard,Jakarta Barat,
100,Keycaps PBT Ukiyo sea-wave XDA profile dye-sub,Rp499.000,Kibaw's store,Jakarta Utara,5.0
101,KEYCAPS PBT DYE SUB XDA PROFILE - Japan Honey and Milk Theme,Rp369.000,LegoDiskon,Tangerang Selatan,5.0
102,Genshin Impact RAIDEN SHOGUN PBT Dye Sub Keycaps Mechanical Keyboard,Rp389.000,Press Play,Jakarta Utara,5.0
103,Press Play Shibuya Japanese Root PBT Keycaps 118 Set OEM Profile,Rp399.000,Chemicy Gaming,Jakarta Pusat,
104,Shenpo PBT keycaps classic with Hebrew sublegends,Rp519.000,Curated By Kwok,Jakarta Utara,4.9
105,Mechanical Keyboard PBT Pudding Keycaps Redragon SCARAB A130 Keycaps,Rp139.000,Gio Gaming Shop,Surabaya,5.0
106,GMK Doubleshot Keycaps Set | PBT Doubleshot | OEM Profile | 126 Keys,Rp399.000,WASD Project,Jakarta Utara,5.0
107,Keycaps Akko Neon ASA Profile 157 Keys PBT Double shot,Rp665.000,Gaming Distro,Jakarta Pusat,
108,KEYCAPS SEA SALT THEME Japanese Root - XDA PROFILE PBT,Rp350.000,kadesh,Jakarta Barat,5.0
109,Keycaps PBT Carbon 108 Keys,Rp175.000,NVlogic,Kab. Bekasi,4.9
110,9009 Retro PBT Dye Sub Keycaps / Keycap Set,Rp355.000,My neighbour keyboard,Tangerang,5.0
111,HyperX Double Shot PBT Pudding Keycaps Full Key Set - White,Rp242.000,Multifungsi,Jakarta Pusat,4.7
112,Navy Theme PBT Dye Sub Keycaps / Keycap Set,Rp485.000,My neighbour keyboard,Tangerang,5.0
113,KEYCAPS KON MOMO ( CLONE ) Japanese Root - XDA PROFILE PBT,Rp375.000,kadesh,Jakarta Barat,5.0
114,Nautilus Blue PBT Doubleshot Keycaps / Keycap Set,Rp389.000,My neighbour keyboard,Tangerang,5.0
115,Paket Combo Keychron K2 v2 RGB Backlight Aluminum + PBT Keycaps Theme,Rp2.000.000,PtNmtindo,Jakarta Barat,5.0
116,Graphite Keycaps 123 Keys Cherry Profile PBT Double Shot Keycap,Rp385.000,Cia Keycaps And Stuff,Jakarta Utara,5.0
117,Noir Keycaps PBT Doubleshot Cherry Profile Keycaps Set,Rp499.000,Goodgamingshop,Jakarta Pusat,5.0
118,Asuka EVANGELION PBT Dye Sub Keycaps Mechanical Keyboard,Rp319.000,Press Play,Jakarta Utara,5.0
119,Cherry Profile PBT Simple White Dye-Subbed Keycaps Set,Rp150.000,Mechaland,Cilegon,4.9
120,Noir Javanese Roots Full Set PBT Dye Sub Cherry Profile WOB - Keycaps,Rp379.000,Goodgamingshop,Jakarta Pusat,5.0
121,Paradox Gaming GH21 PBT Numpad Keycaps (Black/Red)/ABS Black Case,Rp340.000,Goodgamingshop,Jakarta Pusat,4.9
122,LAKESTONE PBT Doubleshot Keycaps Keycap Set,Rp369.000,Press Play,Jakarta Utara,5.0
123,AJAZZ Pudding PBT OEM Profile - Keycaps,Rp199.000,Goodgamingshop,Jakarta Pusat,5.0
124,READY STOCK keycaps gmk mecha 01 eva evangelion cherry profile pbt,Rp600.000,Prings Shop,Jakarta Utara,5.0
125,"""THIS IS PLASTIC"" THEMA KEYCAPS PBT XDA PROFILE",Rp323.000,SmithOrigin,Jakarta Barat,5.0
126,Retrocube Press Play x Jebbra PBT Keycaps,Rp369.000,Press Play,Jakarta Utara,4.9
127,PBTFans BOW Black On White PBT Double Shot Cherry Profile Keycaps,Rp339.000,LegoDiskon,Tangerang Selatan,5.0
128,Keycaps PBT BoW WoB Double shoot cherry profile,Rp475.000,Kibaw's store,Jakarta Utara,5.0
129,Inukuma Japanese Root Keycaps PBT Dye Sub (READY),Rp460.000,Cross Roads Store,Jakarta Utara,5.0
130,Monokei Series 1 - PBT Doubleshot Keycaps,Rp1.260.000,Acid & Co.,Jakarta Barat,5.0
131,Keycaps Gundam 108 PBT Dyesub for Mechanical Gaming Keyboard,Rp379.000,igamerworld,Jakarta Pusat,5.0
132,KBDFans Blue & Gray PBT Cherry Dyesub Keycaps Set,Rp459.000,Cap-stor,Surabaya,5.0
133,Keycaps PBT Japanese BoW WoN WoB cherry profile,Rp399.000,Kibaw's store,Jakarta Utara,5.0
134,Yiqi Keycaps Weather Japanese PBT Dye-Sub XDA Profile,Rp299.000,Goodgamingshop,Jakarta Pusat,5.0
135,Paradox GSA-PBT Dye-sub /Keycaps GSA PBT Dye-sub,Rp295.000,Goodgamingshop,Jakarta Pusat,4.9
136,Press Play Shibuya Japanese Root PBT Keycaps 118 Set OEM Profile,Rp399.000,Sylar Gaming Solution,Jakarta Pusat,5.0
137,HyperX Double Shot PBT Pudding Keycaps,Rp419.000,Chemicy Gaming,Jakarta Pusat,5.0
138,GRAPHITE BLUE KEYCAPS PBT OEM PROFILE,Rp304.000,SmithOrigin,Jakarta Barat,4.8
139,KEYCAPS EMBER XDA Profile PBT Sublimation 125 KEYS,Rp270.000,Delse,Kab. Tangerang,5.0
140,KEYCAPS PBT RUDY MECHANICAL KEYBOARD CHERRY PROFILE DOUBLE SHOT,Rp330.000,BMS Group Tech,Jakarta Pusat,4.9
141,Noir Ocean Keycaps - PBT Doubleshot Cherry Profile Keycap Set,Rp499.000,Noir Gear,Jakarta Barat,4.9
142,Keycaps Mechanical Keyboard PBT Mario Bross 120 Key TERMURAH,Rp250.000,ThockySupply,Madiun,5.0
143,Blank Keycaps OEM Profile PBT,Rp200.000,PKL Mechanical_KB,Jakarta Utara,5.0
144,Shoko Blue Ice PBT Doubleshot Keycaps / Keycap Set,Rp389.000,My neighbour keyboard,Tangerang,4.9
145,RED COKE KEYCAPS PBT OEM PROFILE,Rp275.500,SmithOrigin,Jakarta Barat,5.0
146,Yiqi Keycaps Matcha Japanese Root PBT Dye-Sub XDA Profile,Rp299.000,Goodgamingshop,Jakarta Pusat,5.0
147,Noir Luminous Keycaps - PBT Doubleshot Cherry Profile Keycap Set,Rp499.000,Noir Gear,Jakarta Barat,5.0
148,KEYCAPS VIRTUAL WAR & WARFARE XDA profile PBT dye sub,Rp385.000,kadesh,Jakarta Barat,4.8
149,Olivia White PBT Doubleshot Keycaps / Keycap Set,Rp389.000,My neighbour keyboard,Tangerang,5.0
150,AJAZZ KITTY KEYCAPS DOUBLE SHOT PBT Set JSA Profile (129 Keys),Rp450.000,kadesh,Jakarta Barat,5.0
151,DREAM Keycaps PBT CHERRY PROFILE JAPANESE ROOT,Rp304.000,SmithOrigin,Jakarta Barat,5.0
152,Keycaps Pokemon Pikachu PBT Dyesub for Mechanical Keyboard,Rp379.000,igamerworld,Jakarta Pusat,5.0
153,MILK COVER KEYCAPS PBT CHERRY PROFILE JAPAN ROOT,Rp388.000,SmithOrigin,Jakarta Barat,5.0
154,Dark Cyan PBT Doubleshot Keycaps / Keycap Set,Rp355.000,My neighbour keyboard,Tangerang,5.0
155,HyperX Alloy Origins PBT Keycaps Fullsize Mechanical Gaming Keyboard - Aqua Switch,Rp1.890.000,DUNIA COMPUTER & SERVICE,Jakarta Selatan,
156,Green Ruby PBT Doubleshot Keycaps / Keycap Set,Rp355.000,My neighbour keyboard,Tangerang,5.0
157,KEYCAP - KEYCAPS - OEM - PUDDING GREY - PBT - RGB - SEE THROUGH,Rp140.000,Rumah-Keyboard,Jakarta Barat,5.0
158,Side Letter Backlit PBT Doubleshot Keycaps / Keycap Set,Rp275.000,My neighbour keyboard,Tangerang,5.0
159,KEYCAP - KEYCAPS - CHERRY - GMK BOTANICAL - PBT - DYE SUB,Rp390.000,Rumah-Keyboard,Jakarta Barat,5.0
160,KEYCAP - KEYCAPS - OEM - PUDDING GREY - PBT - RGB - SEE THROUGH,Rp140.000,Rumah-Keyboard,Jakarta Barat,5.0
161,Side Letter Backlit PBT Doubleshot Keycaps / Keycap Set,Rp275.000,My neighbour keyboard,Tangerang,5.0
162,KEYCAP - KEYCAPS - CHERRY - GMK BOTANICAL - PBT - DYE SUB,Rp390.000,Rumah-Keyboard,Jakarta Barat,5.0
163,ALCHA KEYCAPS PBT BACKLIT MECHANICAL KEYBOARD WHITE - RED,Rp247.100,MAGNUN2,Jakarta Barat,
164,TERLARIS Keycaps PBT + SpaceBar Anime,Rp346.000,BeautyHome_,Kab. Bandung,
165,ALCHA KEYCAPS PBT SIDE LETTERS PRINT MECHANICAL KEYBOARD WHITE,Rp325.000,BMS Group Tech,Jakarta Pusat,5.0
166,PBT Dye Sub Mobile Suit Gundam 123 Keycaps/Key Caps OEM Profile SET,Rp480.000,HomeMasterID,Jakarta Utara,
167,KEYCAPS PBT MACAROON XDA PROFILE SUBLIM MECHANICAL KEYBOARD MACARON,Rp290.000,BMS Group Tech,Jakarta Pusat,4.9
168,Yiqi Keycaps Honey milk Japanese PBT Dye-Sub XDA Profile,Rp299.000,Goodgamingshop,Jakarta Pusat,4.5
169,KEYCAPS MATCHA GREEN THEME Japanese Root - XDA PROFILE PBT,Rp330.000,kadesh,Jakarta Barat,4.9
170,EVA Keycaps Mechanical Keyboard Sublime PBT ASUKA 108,Rp319.000,All For Work,Jakarta Barat,5.0
171,KEYCAPS SIKAKEYB GREEN GRAY - Cherry Profile Spherical PBT Double Shot,Rp400.000,kadesh,Jakarta Barat,5.0
172,KBDFans BOW PBT Double Shot Keycaps Set,Rp699.000,Cap-stor,Surabaya,5.0
173,HyperX Pudding Keycaps PBT - White Top,Rp420.000,HyperX Flagship Store,Jakarta Utara,4.9
174,Keycap Keycaps Keyboard Japan PBT OEM Profile Dye Sublimation Purple,Rp110.000,Sinar_Pratama Store,Tangerang Selatan,4.9
175,ALCHA KEYCAPS PBT BACKLIT MECHANICAL KEYBOARD GREY - RED,Rp240.100,MAGNUN2,Jakarta Barat,
176,HyperX Double Shot PBT Keycaps Black,Rp420.000,HyperX Flagship Store,Jakarta Utara,5.0
177,108 Keys OEM PBT Keycaps Full Set Mechanical Keyboard Cute Pikachu Key,Rp425.000,NVS Accessories,Jakarta Pusat,5.0
178,Redragon A130 Scarab PBT Pudding Keycaps For Mechanical Keyboard,Rp145.000,Tokolaptopid,Jakarta Utara,4.8
179,Redragon PBT Pudding Keycaps for Mechanical Keyboard - SCARAB A130,Rp140.000,REDRAGON INDONESIA,Jakarta Utara,4.9
180,KEYCAP - KEYCAPS - CHERRY - GMK BOTANICAL - PBT - DYE SUB,Rp390.000,Rumah-Keyboard,Jakarta Barat,5.0
181,Keycaps Evangelion EVA 01 PBT Dyesub for Mechanical Gaming Keyboard,Rp469.000,igamerworld bekasi,Bekasi,5.0
182,YIQI Keycaps Apple Wind Design PBT Dye Sub XDA Profile,Rp299.000,Goodgamingshop,Jakarta Pusat,5.0
183,CSGO Printstream Keycaps Cherry PBT Profile Sublime 118 Key Set,Rp399.000,All For Work,Jakarta Barat,5.0
184,Keycap Keycaps Genshin Impact 137 set OEM profile PBT Kamisato ayaka,Rp600.000,Sinar_Pratama Store,Tangerang Selatan,5.0
185,Keycaps PBT OEM profile Dye-sublimation purple girl with chinese font,Rp365.000,Kibaw's store,Jakarta Utara,4.7
186,Keycaps PBT Enlightenment Retro Edition XDA profile dye-sub,Rp339.000,Kibaw's store,Jakarta Utara,5.0
187,Redragon A130 Scarab PBT Pudding Keycaps For Mechanical Keyboard,Rp145.000,Tokolaptopid,Jakarta Utara,4.8
188,KEYCAPS PBT DYE SUB - UKIYO E Japan Sea Waves 104 Keys,Rp375.000,LegoDiskon,Tangerang Selatan,4.9
189,Revelation Rocket KEYCAPS PBT XDA PROFILE,Rp304.000,SmithOrigin,Jakarta Barat,5.0
190,alcha keycaps pbt earl orange single shot 108 keys,Rp160.000,Good Stuff Ajar,Jakarta Barat,
191,Akko Black & Rose ASA Profile 197 Set PBT Doubleshot - Keycaps Gaming,Rp739.000,Narvi Gaming,Jakarta Barat,5.0
192,Keychron K5 Full SIze White Backlight Gateron Mechanical Aluminum Body - Red Switch,Rp1.675.000,Keychron Indonesia,Jakarta Barat,5.0
193,KEYCAPS VIRTUAL WAR & WARFARE XDA profile PBT dye sub,Rp385.000,kadesh,Jakarta Barat,4.8
194,KEYCAP - KEYCAPS - MA - BLUE CAT - PBT - DYE SUB - BLUE - 125 KEYS,Rp365.000,Rumah-Keyboard,Jakarta Barat,
195,Keycap Keycaps PBT Dye Sub Kon Momo Clone Cherry Profile,Rp325.000,ThockySupply,Madiun,4.9
196,KEYCAPS PBT CHERRY PROFILE DOUBLE SHOT GMK CLONE RUDY,Rp320.000,Odin Store,Jakarta Pusat,5.0
197,Yiqi Keycaps Ice Crystal Thin mint PBT Dye-Sub XDA Profile,Rp299.000,Goodgamingshop,Jakarta Pusat,5.0
198,SUPER MARIO VILLAIN BOWSER KEYCAPS PBT CHERRY PROFILE,Rp255.200,SmithOrigin,Jakarta Barat,5.0
199,Keycaps Evangelion Ayanami Rei PBT Dyesub 143 for Mechanical Keyboard,Rp469.000,igamerworld,Jakarta Pusat,5.0
200,Yiqi Keycaps Minimalist White Japanese PBT Dye-Sub MDA Profile,Rp329.000,Goodgamingshop,Jakarta Pusat,5.0
201,Keycap Keycaps Genshin Impact 136 set OEM profile PBT theme HUTAO v1,Rp550.000,Sinar_Pratama Store,Tangerang Selatan,5.0
202,KEYCAPS PBT RED SAMURAI DOUBLE SHOT OEM PROFILE MECHANICAL KEYBOARD,Rp350.000,BMS Group Tech,Jakarta Pusat,5.0
203,Keycaps Keycap XDA PBT Honey Milk,Rp250.000,ThockySupply,Madiun,5.0
204,Carbon Color PBT Dye Sub Keycaps / Keycap Set,Rp159.000,My neighbour keyboard,Tangerang,5.0
205,PBT Cherry Milkshake Keycaps,Rp2.199.000,Hi&Co,Jakarta Barat,5.0
206,BLUEBERRY KEYCAPS DOUBLE SHOT PBT Set OEM Profile (119 Keys),Rp300.000,kadesh,Jakarta Barat,4.8
207,GMK BENTO CLONE KEYCAPS PBT CHERRY PROFILE JAPAN ROOT,Rp484.500,SmithOrigin,Jakarta Barat,5.0
208,Keycap Keycaps Genshin Impact 108 set oem profile PBT,Rp650.000,Sinar_Pratama Store,Tangerang Selatan,5.0
209,Noir Smoke Keycaps - PBT Doubleshot Cherry Profile Keycap Set,Rp499.000,Noir Gear,Jakarta Barat,5.0
210,Keycaps PBT Dye Sub BOW Black On White (Black Japanese Root) Cherry,Rp250.000,ThockySupply,Madiun,5.0
211,Keycaps XDA Kon Momo Theme PBT,Rp290.000,AnShop Banjar,Banjar,5.0
212,VORTEXSERIES Pudding Keycaps PBT Doubleshot Backlit 108 Keys - Keycaps,Rp200.000,Goodgamingshop,Jakarta Pusat,4.9
213,Yiqi Keycaps Marshmallow PBT Dye-Sub XDA Profile,Rp299.000,Goodgamingshop,Jakarta Pusat,5.0
214,SA PBT VIOLET DYE-SUB KEYCAPS FULL SET 116/INTERNATIONAL KEYS,Rp720.000,PtNmtindo,Jakarta Barat,5.0
215,Keycaps Phantom PBT Dye Sub Switch 108 Mechanical Keyboard,Rp310.000,All-In Gaming Shop,Jakarta Utara,5.0
216,Yiqi Keycaps Video Game Design PBT Dye-Sub XDA Profile,Rp299.000,Goodgamingshop,Jakarta Pusat,
217,AKKO Carbon Retro CHERRY Profile 229 Keycaps Set PBT Doubleshot,Rp684.000,Narvi Gaming,Jakarta Barat,5.0
218,Custom Backlit Keycaps Set | PBT Doubleshot | OEM Profile | 117 Keys,Rp199.000,WASD Project,Jakarta Utara,5.0
219,SHOKO Keycaps - PBT Double Shot CSA Profile - 229 Keys,Rp449.000,LegoDiskon,Tangerang Selatan,5.0
220,Keycaps bubble pink XDA profile pbt,Rp320.000,Acccomp_07,Depok,5.0
221,Keycaps Kon Momo Japanese PBT 126 Keys XDA Profile,Rp322.300,Nekomech,Malang,5.0
222,DARLING KEYCAPS PBT OEM PROFILE,Rp332.500,SmithOrigin,Jakarta Barat,5.0
223,Blue Ruby PBT Doubleshot Keycaps / Keycap Set,Rp355.000,My neighbour keyboard,Tangerang,5.0
224,KEYCAPS GMK CLONE BLUE SAMURAI PBT DOUBLE SHOT OEM PROFILE KEYBOARD,Rp390.000,Odin Store,Jakarta Pusat,5.0
225,PBTFans Twist Keycaps PBT Double Triple Shot Cherry Profile - KBDFans,Rp1.549.000,LegoDiskon,Tangerang Selatan,5.0
226,Darling Keycaps Double Shot PBT 126 Keys Keycap (GMK CLONE),Rp399.000,Cia Keycaps And Stuff,Jakarta Utara,5.0
227,Keycaps XDA Plastic theme PBT,Rp290.000,AnShop Banjar,Banjar,5.0
228,Yiqi Keycaps Milk purple PBT Dye-Sub XDA Profile,Rp299.000,Goodgamingshop,Jakarta Pusat,5.0
229,Honkai Impact 3 Bronya PBT Dyesub 136 Set Keycaps Cherry Profile,Rp469.000,Chemicy Gaming,Jakarta Pusat,5.0
230,KEYCAP - KEYCAPS - XDA - CHALK MATCHA - PBT - DYE SUB - GREEN - 120,Rp275.000,Rumah-Keyboard,Jakarta Barat,5.0
231,Keycaps Honkai Impact 3 Bronya PBT Dyesub for Mechanical Keyboard,Rp469.000,igamerworld,Jakarta Pusat,5.0
232,Merlin PBT OEM PROFILE DOUBLESHOT Keycaps,Rp322.000,SmithOrigin,Jakarta Barat,5.0
233,Yiqi Keycaps Lights PBT Dye-Sub XDA Profile,Rp299.000,Goodgamingshop,Jakarta Pusat,5.0
234,PBT Dye Sub Demon Slayer Kimetsu no Yaiba 135 Keycaps/Key Caps Cherry,Rp649.000,HomeMasterID,Jakarta Utara,5.0
235,Classic FC / Famicom PBT Dye Sub Keycaps / Keycap Set,Rp495.000,My neighbour keyboard,Tangerang,5.0
236,KEYCAPS MACARON THEME XDA Profile - PBT Dye Sub,Rp350.000,kadesh,Jakarta Barat,5.0
237,HyperX PBT Keycaps - Full Key Set Black,Rp471.000,HyperX Flagship Store,Jakarta Utara,
238,KEYCAPS MATCHA GREEN THEME Japanese Root - XDA PROFILE PBT,Rp330.000,kadesh,Jakarta Barat,4.9
239,KEYCAP - KEYCAPS - CHERRY - SAKURA - PBT - DYE SUB - 122 KEYS,Rp300.000,Rumah-Keyboard,Jakarta Barat,
240,CORSAIR PBT DOUBLE-SHOT PRO Keycap Mod Kit,Rp399.000,Gamer's Outpost,Jakarta Pusat,5.0
241,KEYCAPS - SIKAKEYB - GREEN WHITE - PBT - OEM HEIGHT - SPHERICAL,Rp399.000,Rumah-Keyboard,Jakarta Barat,5.0
242,HyperX Alloy Origins (Red switch) - PBT keycaps - Gaming Keyboard,Rp1.890.000,HyperX Flagship Store,Jakarta Utara,
243,KEYCAP - KEYCAPS - XDA - ICE CREAM - PBT - DYE SUB,Rp290.000,Rumah-Keyboard,Jakarta Barat,
244,HyperX PBT Keycaps - Full Key Set Pink,Rp471.000,HyperX Flagship Store,Jakarta Utara,
245,Keycaps Thick PBT OEM Profile 61 For Mechanical Keyboard,Rp199.000,240z E-Store,Bekasi,4.8
246,GMK ARCTIC CLONE KEYCAPS PBT CHERRY PROFILE,Rp390.000,SmithOrigin,Jakarta Barat,5.0
247,ASUS ROG PBT Keycap Set 124 Keycaps Doubleshot Molded,Rp399.000,PT.SEMPURNA UTAMA,Jakarta Pusat,5.0
248,Keycaps One Piece PBT 129 Tuts Dyesub for Mechanical Gaming Keyboard,Rp469.000,igamerworld,Jakarta Pusat,5.0
249,PARADOX GAMING ZX68-OEM PBT LIGHT TROUGHT KEYCAPS Sea&Sun-ZX68-SWSK,Rp1.015.000,MAXCOM ONLINE,Jakarta Pusat,5.0
250,Nuphy Air PBT Keycaps Twilight - Keycaps ONLY,Rp500.000,GeekyTech Official,Jakarta Utara,
251,Paradox GHOST PBT Dye Sub Side Print Keycaps Grey White Color,Rp265.000,Sylar Gaming Solution,Jakarta Pusat,5.0
252,Yiqi Keycaps Graffiti PBT Dye-Sub XDA Profile,Rp299.000,Goodgamingshop,Jakarta Pusat,5.0
253,TWILIGHT KEYCAPS DOUBLE SHOT PBT Set OEM Profile (119 Keys),Rp300.000,kadesh,Jakarta Barat,5.0
254,Keycaps Cloud Japan PBT Dye Sub Switch 104 Mechanical Keyboard,Rp350.000,All-In Gaming Shop,Jakarta Utara,5.0
255,AKKO Black & Cyan ASA Profile 197 Set PBT Doubleshot - Keycaps Gaming,Rp739.000,Narvi Gaming,Jakarta Barat,5.0
